#chateau-le-payral-sauvignon-blanc-semillon-muscadelle--regular,QQXRCSGBCRBSCJESLTELP4SN,Chateau Le Payral (Sauvignon Blanc/Semillon/Muscadelle),Regular,NA,922631V,"Bin 102
Chateau Le Payral is a crisp and refreshing white wine blend from the Bergerac region of southwestern France. This wine is made from a blend of Sauvignon Blanc, Semillon, and Muscadelle grapes, which are grown on the estate's vineyards and carefully handpicked at the peak of ripeness.
The Chateau Le Payral has a pale yellow color with green reflections and a delicate aroma of citrus, white flowers, and peach, with a hint of tropical fruit. On the palate, it is fresh and vibrant, with flavors of lemon, grapefruit, and pineapple, balanced by a crisp acidity and a touch of minerality. The finish is long and flavorful, with a subtle sweetness and a refreshing aftertaste.
The Sauvignon Blanc, Semillon, and Muscadelle grapes used in this wine are known for their ability to produce complex and aromatic white wines that are both refreshing and satisfying. The grapes are handpicked and sorted, and the juice is fermented in stainless steel tanks and aged on the lees for a few months, which gives the wine a crea",Wine,661799637497,visible,Prepared food and beverage,N,N,N,Y,15.00,N,N,10,-1,Y,25,N,N
#chateau-picard-red-regular,DHHWKCBPG4XHGEXTI5ZLD5PD,Chateau Picard Red,Regular,NA,3612179706446,NA,Wine,NA,visible,Prepared food and beverage,NA,NA,Y,Y,26.00,N,NA,18,12,NA,NA,N,N
#chateau-saintayme-saint-emilion-grand-cru-merlot--regular,WG43WIO6DS5QDJRI46MJWKHT,Chateau Saintayme Saint- Emilion Grand Cru (Merlot),Regular,NA,Saintayme Saint Emillon $35,"Bin 32
Chateau Saintayme Saint-Emilion Grand Cru is a red wine produced in the Saint-Emilion appellation of Bordeaux, France. It is made primarily from the Merlot grape variety, which is known for producing soft and fruity wines.
The wine has a deep ruby color with aromas of red fruits, such as raspberry, cherry, and plum, along with hints of vanilla and oak. On the palate, it is medium to full-bodied with a smooth and velvety texture. The tannins are well-integrated, providing structure and balance to the wine.
Chateau Saintayme Saint-Emilion Grand Cru is aged in oak barrels for about 12 months, which adds complexity and depth to the wine. It has a long, elegant finish with flavors of ripe fruit and a touch of spice.
This wine is a great choice for those who enjoy smooth and easy-drinking red wines. It pairs well with a variety of dishes, including roasted meats, hearty stews, and aged cheeses. Overall, Chateau Saintayme Saint-Emilion Grand Cru is a premium wine that showcases the best qualities of the Merlo",Wine,NA,visible,Prepared food and beverage,N,N,Y,Y,35.00,N,N,25,2,Y,12,N,N
#chateau-tronquoy-lalande-regular,TO3L4H7GSGK5UBEMQEIC346C,Chateau Tronquoy-Lalande,Regular,NA,NA,"Bin 67
Bordeaux",Wine,3277038390794,unavailable,Prepared food and beverage,N,N,N,N,46.00,N,N,31.66,12,NA,NA,N,N
#chatham-cranberry-bar-default,H7Z5KGHWSMJUI5YOA65XETEW,Chatham Cranberry Bar,default,NA,851536005195,"We celebrate Cape Cod's cranberry legacy by sourcing the ingredients for this bar from a family that has been growing the crop for three generations. Rich dark chocolate sourced from the Dominican Republic adds depth to tart dried cranberries. Named after Chatham, a picturesque Cape Cod hamlet, this bar is bursting with local flavor. You can't get much more ""Cape Cod"" than Chequessett Chocolate Chatham Cranberry!

Origin: Dominican Republic
Cacao Content: 70%
Weight: 2 oz (57g)

Ingredients: Organic cacao beans, organic evaporated cane juice, organic cacao butter, cranberries, sunflower oil

This chocolate is gluten-free, vegan, and soy-free.

Designed and handcrafted on Cape Cod in a factory that processes tree nuts and peanuts.",FOOD,NA,visible,Prepared food and beverage,N,N,Y,Y,9.00,N,N,5.5,38,NA,NA,N,N
#cherry-berry-spread-regular,MYCFQ7WIQNZ5BDQUSBSQVGXR,Cherry Berry Spread,Regular,NA,NA,"A delicious breakfast jam made from ripe cherries, blueberries, blackberries, and raspberries. Stir into your favorite yoghurt or spread on your morning toast.

10.6oz recyclable glass jar.
Two year shelf life. Store in a cool, dry place. Refrigerate after opening.
RSP: $7.99

Orders being shipped to the US will require an EIN ( Employer Identification Number) in order to proceed with the order/shipping.",NA,NA,visible,Prepared food and beverage,NA,NA,NA,NA,7.99,N,NA,NA,0,NA,NA,N,N
#cherry-merlot-regular,YIULRUUISAF6CULHOBWBPAYO,Cherry Merlot,Regular,NA,859874001022,NA,FOOD,NA,visible,Physical good,NA,NA,NA,NA,7.00,N,NA,3.49,0,NA,NA,N,N
#cherry-merlot-wine-spread-regular,MRGCZI4YQTWR5NZV3U3AZ3HO,Cherry Merlot Wine Spread,Regular,NA,NA,"The sour cherries and Merlot wine in this luxurious jam will take your cheese and charcuterie board to new flavor heights. Pair with aged, hard cheeses. Serve with your favorite Merlot wine.

5.3 oz recyclable glass jar
2 year shelf life
Store in a cool, dry place
Refrigerate after opening
RSP: $5.99

Orders being shipped to the US will require an EIN ( Employer Identification Number) in order to proceed with the order/shipping.",NA,NA,visible,Prepared food and beverage,NA,NA,NA,NA,5.99,N,NA,NA,0,NA,NA,N,N
#chertok-eve-white-regular,2P67HTF27AWFIX3OESSO2WOT,Chertok Eve White,Regular,NA,NA,NA,Wine,NA,NA,Prepared food and beverage,N,N,Y,Y,29.00,N,N,20,1,N,0,N,N
#chertok-shekhina-regular,UE4HLJXQNYENR7C2LKO2SXQM,Chertok Shekhina,Regular,NA,NA,NA,Wine,NA,visible,Prepared food and beverage,N,N,Y,Y,24.00,N,N,16.66,1,N,0,N,N
#chevoo-herbs-de-provence-marinated-chevre-regular,GJTWKJKE5CPYZJYI255DNX52,Chevoo Herbs de Provence Marinated Chevre,Regular,NA,NA,NA,FOOD,860001269239,visible,Prepared food and beverage,N,N,N,N,8.00,N,N,5.31,2,NA,NA,N,N
#chocolate-confetti-sugarfina-regular,C3BGYUEVZLMCPZBV2EAACZXB,Chocolate Confetti Sugarfina,Regular,NA,NA,NA,FOOD,840278113572,visible,Prepared food and beverage,NA,NA,NA,NA,9.00,N,NA,4.7,0,NA,NA,N,N
#chocolate-works-13-pc-pretzels-gift-box-regular,ASKWUF5IDMSJCNOYT5GRSIWJ,Chocolate Works 13-Pc. Pretzels Gift Box,Regular,NA,691035415404,NA,FOOD,691035415404,unavailable,Physical good,N,N,N,N,18.00,N,N,8.9,5,NA,NA,N,N
#chocolate-works-9-pc-truffle-gift-box-regular,2BMD7KPWJ4U4WSNAHBI7GFGV,Chocolate Works 9-Pc. Truffle Gift Box,Regular,NA,NA,NA,FOOD,745558097309,unavailable,Physical good,NA,NA,NA,NA,15.00,N,NA,7.2,1,NA,NA,N,N
#chopo-monastrell-disc--regular,OU6DGAF46RBGMAXOTWRPIGED,Chopo Monastrell (DISC),Regular,NA,NA,NA,Wine,NA,unavailable,Physical good,N,N,N,N,20.00,N,N,10.98,1,NA,NA,N,N
#chutney-regular,P4H7T66SY3UQ5KONUEFEHE7K,Chutney,Regular,NA,BC,NA,FOOD,NA,unavailable,Prepared food and beverage,N,N,N,N,8.00,N,N,4,0,NA,NA,N,N
#ch-teau-des-rontets-pouilly-fuiss-chardonnay--regular,3DLJ2AYOWB7NTSGDZHTSFBJA,Château Des Rontets Pouilly-Fuissé (Chardonnay),Regular,NA,438172R,"Bin 218 Château Des Rontets Pouilly-Fuissé is a rich and elegant white wine from the Burgundy region of France. This wine is made from 100% Chardonnay grapes, which are grown on the estate's vineyards and carefully handpicked at the peak of ripeness.
The Pouilly-Fuissé has a pale gold color and a complex bouquet of citrus, pear, and white flowers, with a hint of vanilla and honey. On the palate, it is full-bodied and rich, with flavors of ripe fruit, toasted nuts, and a touch of oak. The acidity is well-balanced, giving the wine a long and satisfying finish.
The Chardonnay grapes used in this wine are known for their versatility and ability to express the terroir where they are grown. The grapes are handpicked and gently pressed, and the juice is fermented in oak barrels for several months, which gives the wine its rich and complex flavor profile.
Overall, Château Des Rontets Pouilly-Fuissé is a superb and authentic wine that showcases the quality and character of Chardonnay from Burgundy. It is a perfect choice for",Wine,NA,visible,Prepared food and beverage,N,N,N,Y,42.00,N,N,28,1,Y,5,N,N
#ch-teau-leret-monpezat-malbec-regular,C2DQOD6YMZC2S2I42DUOOICP,Château Leret Monpezat Malbec,Regular,NA,NA,"Bin 41
Château Leret Monpezat Malbec is a red wine made from the Malbec grape variety, grown in the region of Cahors in southwestern France. The wine is produced by Château Leret Monpezat, a family-owned winery known for producing high-quality Malbec wines.
The wine has a deep, ruby color and a rich, full-bodied taste. It is characterized by intense aromas of black fruits, such as blackcurrant, blackberry, and plum, with hints of spice and vanilla. On the palate, it is well-structured with firm tannins and a long, complex finish.
Château Leret Monpezat Malbec is typically aged in oak barrels for several months, which adds complexity and depth to the wine. It is a versatile wine that pairs well with a variety of dishes, including grilled meats, stews, and strong cheeses.
Overall, Château Leret Monpezat Malbec is a premium wine that showcases the best qualities of the Malbec grape variety. It is a great choice for wine enthusiasts who appreciate rich, complex red wines with a strong sense of terroir.",Wine,648977689127,visible,Prepared food and beverage,N,N,N,Y,25.00,N,N,17.33,25,Y,5,N,N
#ch-teau-marjosse-2019-bordeaux-regular,2XD526NAH3SN4XKKSXIGRE5T,Château Marjosse 2019 Bordeaux,Regular,NA,NA,Bin 251,Wine,3760040180076,unavailable,Prepared food and beverage,N,N,N,N,23.00,N,N,12.66,43,NA,NA,N,N
#ch-teau-yvonne-saumur-blanc--regular,PCAPQRRZYRKTKIJHNWPILDGB,Château Yvonne ( Saumur Blanc),Regular,NA,YVONNE,"Bin 130
Château Yvonne is a crisp and refreshing white wine from the Saumur region of the Loire Valley in France. This wine is made from 100% Chenin Blanc grapes, which are grown on the estate's vineyards and carefully handpicked at the peak of ripeness.
The Château Yvonne has a pale yellow color with green reflections and a delicate aroma of citrus, white flowers, and honey, with a hint of minerality. On the palate, it is fresh and vibrant, with flavors of lemon, green apple, and peach, balanced by a crisp acidity and a touch of sweetness. The finish is long and satisfying, with a subtle floral note and a refreshing aftertaste.
The Chenin Blanc grape is known for its ability to produce complex and aromatic white wines that are both refreshing and satisfying. The grapes are handpicked and sorted, and the juice is fermented in stainless steel tanks and aged on the lees for a few months, which gives the wine a creamy and smooth texture.
Overall, Château Yvonne is a well-balanced and flavorful wine that is perfe",Wine,NA,visible,Prepared food and beverage,N,N,Y,Y,46.00,N,N,31.66,6,N,5,N,N
#ch-teau-de-gaudo-puro-malbec--regular,6Z572XJS3BZQYNYN6J35EZ65,Château de Gaudo 'Puro' (Malbec),Regular,NA,NA,"Bin 117
Château de Gaudo 'Puro' is a rich and elegant wine made from the Malbec grape variety in the Cahors region of France. This wine is produced by Château de Gaudo, a family-owned winery known for its traditional winemaking practices and its commitment to preserving the heritage of the Cahors region.
The Puro has a deep and intense ruby color and a complex bouquet of dark fruit, such as black cherry and blackberry, mixed with spicy notes of vanilla and cinnamon. On the palate, it is full-bodied and rich, with flavors of ripe fruit, chocolate, and a hint of earthiness. The tannins are firm yet smooth, giving the wine a long and satisfying finish.
The Malbec grape used in this wine is a historic grape variety that has been cultivated in the Cahors region for over 2,000 years. It is known for its deep color and intense flavor profile, and it is considered one of the finest grape varieties in the world for red wine production. The grapes are grown on vineyards that are certified organic, which means that the",Wine,3365586017512,hidden,Prepared food and beverage,N,N,N,Y,14.00,N,N,10,4,Y,5,N,N
#ch-teau-de-grangeneuve-blanc-sauvignon-blanc-semillon-dsc-regular,A2RDJTQVPZKDO3D24A4NK7T5,Château de Grangeneuve Blanc (Sauvignon Blanc/ Semillon) DSC,Regular,NA,3251158,"DSC
Château de Grangeneuve Blanc is a refreshing and crisp white wine from the Bordeaux region of France. This wine is made from a blend of Sauvignon Blanc and Semillon grapes, which are grown on the estate's vineyards and carefully handpicked at the peak of ripeness.
The Blanc has a pale yellow color and a complex bouquet of citrus, tropical fruit, and floral notes, with a hint of grassiness. On the palate, it is fresh and lively, with flavors of lemon, grapefruit, and green apple, mixed with a subtle mineral character. The acidity is well-balanced, giving the wine a bright and refreshing finish.
The Sauvignon Blanc and Semillon grapes used in this wine are known for their aromatic and flavorful qualities, and they complement each other perfectly in this blend. The grapes are harvested in the early morning to preserve their freshness and are then fermented separately in stainless steel tanks. The wine is aged on the lees for a few months, which gives it a creamy and smooth texture.
Overall, Château de Gr",Wine,3760098191116,unavailable,Prepared food and beverage,N,N,N,Y,19.00,Y,N,11.33,0,Y,5,N,N
#ch-teau-de-grangeneuve-rouge-merlot-cabernet-franc-dsc-regular,YTTIPB4G4Q22Z532243NQGEF,Château de Grangeneuve Rouge (Merlot/Cabernet Franc) DSC,Regular,NA,NA,"DSC
Château de Grangeneuve Rouge is a red wine produced in the Cahors region of Southwest France. This wine is a blend of Malbec, Merlot, and Tannat grapes, which are grown in the clay and limestone soils of the region. The wine is aged for 12 months in oak barrels, giving it a rich and complex flavor profile. Château de Grangeneuve Rouge is characterized by its deep purple color and aromas of black fruit, spice, and vanilla. On the palate, it is full-bodied with firm tannins and flavors of blackberry, plum, and dark chocolate. This wine pairs well with hearty dishes such as grilled meats, stews, and hard cheeses. Overall, Château de Grangeneuve Rouge is an excellent choice for those seeking a full-bodied and complex red wine from one of France's most historic wine regions.",Wine,3760098191024,unavailable,Prepared food and beverage,N,N,N,Y,24.00,Y,N,13.33,0,Y,5,N,N
#ch-teau-de-roques-merlot-cabernet-sauvignon-cabernet-franc--regular,PIQHTET3P2PMQIT6XYYT634M,Château de Roques (Merlot/Cabernet Sauvignon/Cabernet Franc),Regular,NA,NA,"Bin 60

Château de Roques wine is like a fine work of art, but instead of canvas and paint, it's made with Merlot, Cabernet Sauvignon, and Cabernet Franc grapes. With its deep ruby color and complex flavor profile, this wine is the Mona Lisa of the wine world. Every sip is like taking a brushstroke on your tongue, with layers of rich fruit flavors and subtle hints of oak and spice.
But don't let the fancy French name fool you, Château de Roques is not just for the elite wine snobs. It's for anyone who appreciates a good laugh and a great bottle of wine. After all, the only thing better than drinking a glass of Château de Roques is saying the name out loud in your best French accent. It's a tongue twister that's sure to impress at your next dinner party.
So whether you're a wine aficionado or just looking for a good time, Château de Roques is the perfect choice. Just remember, it's pronounced ""Sha-toe duh Rokes"" and not ""Chat-toe dee Rokes"" or you might get some funny looks.",Wine,811502020843,unavailable,Prepared food and beverage,NA,NA,N,Y,20.00,Y,N,11.33,0,Y,5,N,N
#ch-teau-du-grand-bos-graves-regular,YH5T23PWMHWYMMXUZJWEQ7OU,Château du Grand Bos Graves,Regular,NA,CDGBG,Bin 60,Wine,NA,unavailable,Physical good,N,N,N,N,24.00,N,N,15,23,NA,NA,N,N
#ch-ne-saint-louis-cave-des-vins-sancerre-discontinued-regular,5ORFYMD5REB3UFNDQKFJUO3S,Chêne Saint-Louis Cave Des Vins Sancerre DISCONTINUED,Regular,NA,3230410442016,Boston,Wine,NA,unavailable,Prepared food and beverage,N,N,N,N,32.00,N,N,19.97,0,Y,5,N,N
#circle-easter-felt-regular,FUNDAIDXZKFRBPSB2CSOFVSA,Circle Easter Felt,Regular,NA,NA,NA,Baskets,200030460489,visible,Physical good,NA,NA,NA,NA,10.00,N,NA,NA,2,NA,NA,N,Y
#classic-cult-crackers-regular,K5CZIWAOZGRVYI5OYSX25AVN,Classic Cult Crackers,Regular,NA,860362000403,NA,FOOD,NA,visible,Prepared food and beverage,N,N,Y,Y,8.00,N,N,4.99,-3,Y,12,N,N
#clos-fornelli-la-robe-d-ange-rouge-sciaccarello--regular,5OZ7CBRTTIL3ZITUSJSBEMPL,Clos Fornelli La Robe D'Ange Rouge (Sciaccarello),Regular,NA,"Clos Fornelli Robe d""Ange Rouge $19","Bin 63
This wine is made from a very rare grape found only in Corsica called Sciaccarello (pronounced Shak-a-rello). It has a similar weight to Pinot Noir and is produced in a similar style, but has a spicy edge to it that makes it a delight. Josee Vanucci and her husband farm organically and concentrate their efforts on grapes that are not commonly found elsewhere. The name La Robe d'Ange means The Angel's Dress.
Pair with anything from fish to white meats and cheeses

100% Sciaccarello
Vin de Corse, France",Wine,NA,visible,Prepared food and beverage,N,N,N,Y,19.00,N,N,13,49,N,5,N,N
#cloth-wine-bag-regular,554BFQORENN6KYVEMVKRVVSS,Cloth Wine Bag,Regular,NA,06010544,NA,Merchandise (non-food),NA,visible,Prepared food and beverage,NA,NA,NA,NA,12.00,N,NA,4.5,1,NA,NA,N,Y
#club-soda-can-5-oz-regular,HWW2N7JOVYZXSAUGTXLVJFB6,Club Soda Can 5 oz,Regular,NA,812136030321,NA,Alcohol-Free,812136030321,visible,Prepared food and beverage,NA,NA,NA,NA,2.00,N,NA,0.93,1,NA,NA,N,N
#cobalt-swirl-plate-regular,Y4ZYSE2RH4EA457MKV74RYM5,Cobalt Swirl Plate,Regular,NA,NA,NA,Pottery,NA,visible,Prepared food and beverage,N,NA,NA,Y,45.00,N,NA,30,1,NA,NA,N,Y
#cobb-hill-cheese-good-old-gouda-regular,J3OIQ43W6WT6VJSS2JADFXKE,"Cobb Hill Cheese Good, Old Gouda",Regular,NA,CHCGOG,NA,FOOD,NA,visible,Physical good,NA,NA,NA,NA,20.00,N,NA,13.8,17,NA,NA,N,N
#cobb-hill-cheese-holy-smokes-gouda-regular,MUXRDIBMYHDEKX3IJSWFNZVC,Cobb Hill Cheese Holy Smokes Gouda,Regular,NA,CHCHSG,NA,FOOD,NA,visible,Physical good,NA,NA,NA,NA,16.00,N,NA,11.57,1,NA,NA,N,Y
#cocagne-mackerel-fillets-in-olive-oil-regular,ODUZIGONQWR7XGPZCA4FPNSY,Cocagne Mackerel Fillets In Olive Oil,Regular,NA,5601010124035,NA,Tinned Fish,NA,visible,Physical good,NA,NA,NA,NA,8.00,N,NA,4.8,5,NA,NA,N,N
#cocagne-sardines-in-light-brine-regular,BHREWTQJD57KYBW7QNSFGJUW,Cocagne Sardines In Light Brine,Regular,NA,650882114267,NA,Tinned Fish,NA,visible,Prepared food and beverage,N,N,Y,Y,8.00,N,N,5.59,0,Y,5,N,N
#cocagne-small-sardines-in-spicy-olive-oil-regular,I2JRSZPBTY732AN2BSDIS7FZ,Cocagne Small Sardines in Spicy Olive Oil,Regular,NA,5601010114081,NA,FOOD,5601010114081,visible,Prepared food and beverage,NA,NA,NA,NA,9.00,N,N,5.59,1,NA,NA,N,N
#cocktail-mixed-nuts-regular,GA2F2XOSSK7E3HJICZBB62AK,Cocktail Mixed Nuts,Regular,NA,794711012062,NA,FOOD,NA,visible,Physical good,NA,NA,NA,NA,4.00,N,NA,1.3,-19,NA,NA,N,N
#cocoa-cakes-regular,YBJLJ3LSJSIWUX2B3VFFLOXW,Cocoa-Cakes,Regular,NA,891077002086,NA,FOOD,NA,visible,Prepared food and beverage,NA,NA,Y,Y,7.00,N,N,4.11,1,Y,12,N,N
#coconut-toffee-macademias-sugarfina-regular,3D2ILWO4NWBT3OFHLIYSFEIH,Coconut Toffee Macademias Sugarfina,Regular,NA,840278148857,NA,FOOD,NA,visible,Prepared food and beverage,NA,NA,Y,Y,9.00,N,NA,5.42,3,NA,NA,N,N
#comelli-pinot-grigio--regular,6YOMIRCGBUNQI77BZ4JUHJS7,Comelli (Pinot Grigio),Regular,NA,716146144019,"Bin 33
Comelli Pinot Grigio is a white wine produced in the Friuli-Venezia Giulia region of northeastern Italy. It is made from the Pinot Grigio grape variety, which is known for producing crisp and refreshing wines.
The wine has a straw-yellow color and aromas of citrus fruits, such as lemon and grapefruit, as well as green apple and pear. On the palate, it is light-bodied with a bright acidity and flavors of lemon, apple, and a hint of minerality. It has a clean, refreshing finish that makes it a great wine for pairing with food.
Comelli Pinot Grigio is a versatile wine that pairs well with a variety of dishes, including seafood, salads, and light pasta dishes. It is also a great wine to enjoy on its own as an aperitif.
Overall, Comelli Pinot Grigio is a classic example of a well-made Italian white wine. It is crisp, refreshing, and easy to drink, making it a great choice for those who enjoy light and aromatic wines.",Wine,NA,visible,Prepared food and beverage,N,N,N,Y,21.00,N,N,13.83,49,Y,24,N,N
#comelli-sauvignon-blanc-dsc-regular,Q5HYE5WUMIIB54SCVKFLLS56,Comelli (Sauvignon Blanc) DSC,Regular,NA,CSB,"DSC
Comelli Sauvignon Blanc is a fresh and vibrant white wine from the Friuli Venezia Giulia region in northeastern Italy. This wine is made from 100% Sauvignon Blanc grapes, which are grown on the estate's vineyards and carefully handpicked at the peak of ripeness.
The Comelli Sauvignon Blanc has a pale yellow color with green reflections and a delicate aroma of citrus, green apple, and passion fruit, with a hint of mineral notes. On the palate, it is fresh and lively, with flavors of lemon, grapefruit, and tropical fruit, balanced by a crisp acidity and a touch of herbal notes. The finish is long and refreshing, with a subtle sweetness and a pleasant aftertaste.
The Sauvignon Blanc grape is known for its ability to produce complex and aromatic white wines that are both refreshing and satisfying. The grapes are handpicked and sorted, and the juice is fermented in stainless steel tanks and aged on the lees for a few months, which gives the wine a creamy and smooth texture.
Overall, Comelli Sauvignon Blanc",Wine,NA,visible,Prepared food and beverage,Y,N,N,Y,28.00,N,N,18.17,-2,Y,12,N,N
#companhia-de-pescarias-do-algarve-mackerel-fillets-in-olive-oil-regular,TWBT6ZGD76KDBU2FGEU4ML4C,Companhia de Pescarias Do Algarve - Mackerel Fillets in Olive Oil,Regular,NA,5601943001359,NA,FOOD,5601943001359,visible,Prepared food and beverage,NA,NA,NA,NA,7.00,N,NA,4.2,6,NA,NA,N,N
#conservas-santos-mackerel-pate-regular,SLOQLZ3NS6UG5CDDUAJEBBLO,Conservas Santos Mackerel Pate,Regular,NA,5604739001205,NA,Tinned Fish,NA,visible,Prepared food and beverage,NA,NA,Y,Y,6.00,N,N,3.99,0,NA,NA,N,N
#conservas-santos-tuna-pate-regular,WKWYEUKLAHSSHSPMQPVYOM5U,Conservas Santos Tuna Pate,Regular,NA,5604739001212,NA,Tinned Fish,NA,visible,Prepared food and beverage,NA,NA,Y,Y,6.00,N,N,3.99,0,NA,NA,N,N
#contrada-salandra-falanghina-2018-regular,3LTYPLR3HIYKEGUHHVUEYCDI,Contrada Salandra Falanghina 2018,Regular,NA,csf2018,"Bin 249
The steepest vineyards of Giuseppe Fortunato over Campi Flegrei give his Falanghina a graceful tension and definition, while longer ageing brings more weight and balance. If the 2017 appears too lean and a bit simplistic, possibly from an early harvest, the 2018 has a more complete profile: white melon, grapefruit and honey richness. It’s vibrant on the palate, with a full weight and tingling freshness due to a low pH, typical of this variety. Drink: 2021-2023. (Sep 2020)""",Wine,NA,unavailable,Physical good,N,N,N,N,22.00,N,N,16.66,21,NA,NA,N,N
#cookies-and-cream-sugarfina-regular,3T6U2V4IKK4ZZ5ALBGUZDTHG,Cookies and Cream Sugarfina,Regular,NA,840278161412,NA,FOOD,NA,hidden,Prepared food and beverage,NA,NA,Y,Y,9.00,N,NA,5.42,0,NA,NA,N,N
#coppo-gavi-regular,44WBHNMIFOJKJG6S3FHTXJVG,Coppo Gavi,Regular,NA,NA,Bin 269,Wine,851362003068,visible,Physical good,N,N,N,N,19.00,N,N,12,16,NA,NA,N,N
#coppo-l-avvocata-barbers-d-asti-regular,3DP74ZUXFAN4ISI44BO5ZF4Z,Coppo L'Avvocata Barbers D'Asti,Regular,NA,851362003075,Bin 232,Wine,NA,NA,Prepared food and beverage,N,N,N,N,19.00,N,N,9.66,37,NA,NA,N,N
#cork-screw-regular,YVJIVRFDJETJLFMLNTQVUS5S,Cork Screw,Regular,NA,L159820,NA,Misc.,NA,visible,Prepared food and beverage,NA,NA,NA,Y,5.00,N,N,2.95,-4,NA,NA,N,Y
#cornichons-gherkins-regular,ONZUZFP3IIGUKU7JYH74ZBGE,Cornichons Gherkins,Regular,NA,850023671073,NA,FOOD,850023671073,visible,Physical good,NA,NA,NA,NA,7.00,N,NA,3.5,4,NA,NA,N,N
#costa-esmeraldas-chocolate-bar-regular,OYOJX4WBMLXD5WN3OO4A5LHF,Costa Esmeraldas Chocolate Bar,Regular,NA,851536005454,NA,FOOD,NA,visible,Prepared food and beverage,NA,NA,Y,Y,9.00,N,NA,6,1,NA,NA,N,N
#cotton-blanket-regular,UQCVOWRSVCKISHIXN7ZQGREO,Cotton Blanket,Regular,NA,200030480524,NA,Misc.,NA,visible,Prepared food and beverage,N,N,N,N,35.00,N,N,NA,-7,NA,NA,N,Y
#cownty-tales-reserve-wedge-regular,L5HG7TZLRYBMGW77PFWLVDUA,Cownty Tales Reserve Wedge,Regular,NA,NA,NA,FOOD,NA,visible,Prepared food and beverage,NA,NA,NA,NA,8.00,N,NA,5.6,0,NA,NA,N,N
#cranberry-apple-cider-vinegar-regular,7AUKJXFDFZOE7M2XD64TANL6,Cranberry Apple Cider Vinegar,Regular,NA,850009723093,NA,FOOD,NA,hidden,Prepared food and beverage,NA,NA,NA,Y,12.00,N,N,7.9,0,Y,4,N,N
#cravero-parmigiano-reggiano-regular,PAVBMB4VCHJADN7CGWAY6XNZ,Cravero Parmigiano Reggiano,Regular,NA,860003980231,NA,FOOD,NA,NA,Prepared food and beverage,NA,NA,NA,NA,23.00,N,NA,15,-1,NA,NA,N,Y
#creative-co-op-4-l-x-2-w-handmade-paper-gift-tag-with-gold-block-print-and-jute-tie-green-and-white-boxed-set-of-12-office-decor-x-x-0-h-regular,4LRMF2KPRB7HMLBATKOUCMKA,"Creative Co-Op 4"" L x 2"" W Handmade Paper Gift Tag with Gold Block Print and Jute Tie, Green and White, Boxed Set of 12 Office Decor, x x 0"" H",Regular,NA,NA,NA,Holiday,191009484806,visible,Prepared food and beverage,NA,NA,NA,NA,10.00,N,NA,5,-1,NA,NA,N,Y
#creative-co-op-whimsical-pattern-decorator-paper-59-l-x-0-w-x-98-h-regular,342BJW2IES7B5UQKMXE36W5U,"Creative Co-Op Whimsical Pattern Decorator Paper, 59 "" L x 0 "" W x 98 "" H",Regular,NA,30191009479490,NA,Merchandise (non-food),191009479499,visible,Prepared food and beverage,NA,NA,NA,NA,80.00,N,NA,40,1,NA,NA,N,Y
#creative-co-op-floral-multicolor-wall-decorator-paper-regular,HYJIPOG2HJ4KUYBJRK7GERBK,"Creative Co-op Floral, Multicolor Wall Decorator Paper",Regular,NA,00191009523789,NA,Merchandise (non-food),191009523789,visible,Prepared food and beverage,NA,NA,NA,NA,50.00,N,NA,25,2,NA,NA,N,Y
