#prapian-3-prosecco-extra-dry-glera--regular,3DRNQXOMNLG6EHHCCYZ4W4WN,Prapian '3' Prosecco Extra Dry (Glera),Regular,NA,NA,"Bin 83
Prapian 3 Prosecco is like a bubbly symphony for your taste buds, with each sip bursting with flavor and excitement. Made from the finest Glera grapes, this Italian sparkling wine is the perfect way to add a touch of fun and sophistication to any occasion.
From its effervescent bubbles to its delicate floral aroma, Prapian 3 Prosecco is a wine that will put a smile on your face and a spring in your step. Whether you're sipping it poolside on a hot summer day or toasting to a special occasion with friends and family, this wine is sure to impress.
So why settle for ordinary when you can have extraordinary? Indulge in the playful and delightful Prapian 3 Prosecco and experience the magic of Italian winemaking at its finest. Cheers to life and all its bubbly surprises!",Wine,8005172401039,visible,Prepared food and beverage,N,N,N,Y,20.00,N,N,11.99,14,Y,24,N,N
#premium-board-with-handles-regular,Y7GFQOQL43WKJHWE6DVOOFM2,Premium Board With Handles,Regular,NA,NA,NA,Cutting Boards - Made by Nate,NA,hidden,Prepared food and beverage,NA,NA,NA,Y,120.00,N,NA,NA,0,NA,NA,N,N
#premium-tonic-water-regular,3AOBZBN7IAQ5SOVB72KZM36K,Premium Tonic Water,Regular,NA,898195001007,NA,Alcohol-Free,898195001007,unavailable,Prepared food and beverage,N,N,N,N,10.00,N,N,4.91,13,NA,NA,N,N
#preserved-lemons-piccolo-regular,V4HD6HT2T6FSKC77O7M4KEEL,Preserved Lemons Piccolo,Regular,NA,NA,NA,FOOD,619130009427,visible,Prepared food and beverage,NA,NA,Y,Y,20.00,N,NA,11.5,1,NA,NA,N,N
#primitif-georgian-wine-regular,UVBSYUL5QIFCQTDMVLWWCHCB,Primitif Georgian Wine,Regular,NA,3770024817003,NA,Wine,3770024817003,unavailable,Prepared food and beverage,N,N,N,N,24.00,N,N,16.58,0,NA,NA,N,N
#proclamation-ale-co-fade-to-white-regular,63DZ5QPE3EGEFK7NIURY47E4,Proclamation Ale Co Fade to White,Regular,NA,NA,NA,Beer,745687274398,visible,Physical good,N,N,N,N,16.00,N,N,10.5,0,NA,NA,N,N
#proclamation-ale-company-pilsner-flummox-4pk-regular,JJWNKOU5PNXR2FP5Q3YN4TM2,"Proclamation Ale Company, Pilsner Flummox, 4pk",Regular,NA,669393984313,NA,Beer,669393984313,visible,Prepared food and beverage,NA,NA,NA,NA,15.00,N,NA,10.5,0,NA,NA,N,N
#proclamation-proc-circles-lager-regular,RLGRF4I3BN3ZD2HZSTSTNKLT,Proclamation Proc Circles Lager,Regular,NA,745687273773,NA,Beer,NA,visible,Prepared food and beverage,N,N,N,N,16.00,N,N,11.2,4,NA,NA,N,N
#produttori-del-barbaresco-nebbiolo--regular,257YGOFSW35USRMHRR4NH7OR,Produttori Del Barbaresco (Nebbiolo),Regular,NA,NA,"Produttori Del Barbaresco is a renowned Italian winery located in the Piedmont region of northwest Italy. The winery is well known for its outstanding Nebbiolo wines, which are considered some of the best in the world.
Nebbiolo is a red grape variety that is grown primarily in the Piedmont region of Italy. It is known for producing wines with high acidity, firm tannins, and complex flavors that often include notes of cherry, tar, and rose petals. Nebbiolo wines are also known for their ability to age well, with some of the best examples continuing to develop and improve for several decades.
The Produttori Del Barbaresco Nebbiolo is a classic example of the grape variety, with a deep ruby color and intense aromas of red fruits, leather, and tobacco. On the palate, the wine is full-bodied and complex, with flavors of cherries, blackberries, and licorice, along with hints of earth and spice. The tannins are firm and well-structured, giving the wine a long and elegant finish.
One of the unique aspects of the Prod",Wine,NA,visible,Prepared food and beverage,N,NA,N,Y,115.00,N,N,81,1,N,2,N,N
#provincetown-pure-dark-regular,AJQSOMUOMW7NFCJWO5VBJTS5,Provincetown Pure Dark,Regular,NA,851536005027,NA,FOOD,NA,visible,Prepared food and beverage,NA,NA,NA,Y,9.00,N,NA,5.5,1,NA,NA,N,N
#provisions-french-onion-regular,WKTS4J4I4KEJTAMDG7JYVFTJ,Provisions French Onion,Regular,NA,990013800066,NA,FOOD,990013800066,visible,Physical good,NA,NA,NA,NA,7.00,N,NA,3.49,4,NA,NA,N,N
#provisions-loaf-regular,OWGUUBVHK7JQO2HM667BBY56,Provisions Loaf,Regular,NA,448510Y,NA,Bread,NA,hidden,Prepared food and beverage,NA,NA,NA,Y,6.00,N,NA,5,-323,NA,NA,N,N
#provisions-peach-apricot-regular,53VXG6M7OVRZNE3FAJTAYEOP,Provisions Peach Apricot,Regular,NA,859874001039,NA,FOOD,NA,visible,Physical good,NA,NA,NA,NA,12.00,N,NA,8,0,NA,NA,N,N
#provisions-pear-riesling-regular,E4DFA3AZEANJS3G6E27OLJXO,Provisions Pear Riesling,Regular,NA,990013800080,NA,FOOD,990013800080,visible,Physical good,NA,NA,NA,NA,7.00,N,NA,3.49,1,NA,NA,N,N
#provisions-red-pepper-jelly-regular,NNDV3W6UVZMP26NZPZ2SW2U2,Provisions Red Pepper Jelly,Regular,NA,859874001060,NA,FOOD,NA,visible,Physical good,NA,NA,NA,NA,7.00,N,NA,3.49,6,NA,NA,N,N
#provisions-smoky-sea-salt-regular,5NTTRTLIDMXB7DXRBZCFAQ3D,Provisions Smoky Sea Salt,Regular,NA,859874001404,NA,FOOD,NA,visible,Physical good,NA,NA,NA,NA,7.00,N,NA,3.49,0,NA,NA,N,N
#pulpo-octopus-in-spanish-olive-oil-regular,RZVCFRTZTTWADIVDBRCOTFN2,Pulpo Octopus in Spanish Olive Oil,Regular,NA,83294005218,NA,Tinned Fish,832924005218,visible,Prepared food and beverage,NA,NA,NA,NA,16.00,N,NA,10.08,11,NA,NA,N,N
#purpletown-shrub-regular,PDGSSAQIOEZSFDUMVNHTDUSZ,PurpleTown Shrub,Regular,NA,PTS,NA,Alcohol-Free,NA,visible,Prepared food and beverage,NA,NA,N,Y,16.00,N,N,12,6,NA,NA,N,N
#queen-honey-organic-wildflower-regular,7L3623D7MEOBZU2LAOXQT4PR,Queen Honey Organic Wildflower,Regular,NA,086990485010,NA,FOOD,NA,hidden,Prepared food and beverage,NA,NA,NA,Y,13.00,N,NA,NA,0,NA,NA,N,N
#queen-of-the-coast-sardines-in-veg-oil-regular,RFF2WXANDCSKHWOLGG6ZIJXB,Queen Of The Coast Sardines In Veg. Oil,Regular,NA,650882511714,NA,Tinned Fish,NA,unavailable,Physical good,N,N,N,N,10.00,N,N,4.93,1,Y,5,N,N
#queen-of-the-coast-skipjack-tuna-in-water-regular,VK2ZWAZSA7HOE7DU4CEUDDIS,Queen Of The Coast Skipjack Tuna In Water,Regular,NA,650882531736,NA,Tinned Fish,NA,unavailable,Physical good,N,N,N,N,12.00,N,N,4.88,3,Y,5,N,N
#queen-of-the-coast-spiced-sardines-in-veg-oil-regular,H45YOYYYPPL3WOOQC5X5VZVR,Queen Of The Coast Spiced Sardines In Veg. Oil,Regular,NA,650882511769,NA,Tinned Fish,NA,unavailable,Physical good,N,N,N,N,10.00,N,N,4.99,3,Y,5,N,N
#queen-of-the-coast-tuna-in-veg-oil-regular,RG4EHYFFFSNKACTNUBKOJD37,Queen Of The Coast Tuna In Veg. Oil,Regular,NA,650882531712,NA,Tinned Fish,NA,unavailable,Physical good,N,N,N,N,11.00,N,N,4.88,2,Y,5,N,N
#quinta-varzea-da-pedra-arinto--regular,OIKTKLARDYIKJHEEMILOPTWO,Quinta Varzea Da Pedra (Arinto),Regular,NA,5130275,"Bin 19
Quinta Varzea Da Pedra is a Portuguese winery known for its production of high-quality Arinto wines. Arinto is a white grape variety native to Portugal, which is highly appreciated for its crisp acidity and citrusy flavors.
The vineyard is located in the Tejo region, known for its warm and dry climate, and its unique soil composition, which consists of a combination of limestone and clay. The vineyard's location on a gently sloping hillside, with a south-facing exposure, ensures optimal sun exposure and helps to regulate temperatures, contributing to the quality of the grapes.
Quinta Varzea Da Pedra's Arinto is produced using traditional winemaking methods, including manual harvesting and gentle pressing of the grapes. The wine is fermented in stainless steel tanks at controlled temperatures, which helps to preserve the fruit flavors and aromas of the grapes. The resulting wine is bright and refreshing, with a delicate aroma of citrus fruits, green apples, and white flowers.
This Arinto is a perfect pa",Wine,5600735368359,visible,Prepared food and beverage,N,N,N,Y,15.00,N,N,10,16,Y,12,N,N
#quinta-da-alorna-tejo-lutra-tinto-dsc-regular,KILEIWT5CVWUE6FAUEY4WDUQ,Quinta da Alorna Tejo Lutra Tinto DSC,Regular,NA,NA,"Bin 125
DSC
Quinta da Alorna Lutra Tinto is a remarkable wine that showcases the best of Portuguese winemaking traditions and the unique terroir of the Alentejo region. Crafted with meticulous care and attention to detail, this red wine offers an exceptional drinking experience.
The Lutra Tinto is a blend of carefully selected grape varieties, combining the rich and robust character of Alicante Bouschet with the elegance of Touriga Nacional and the structure of Trincadeira. This thoughtful blend results in a wine that is both expressive and balanced, with each grape contributing its unique attributes to the final composition.
In the glass, the Lutra Tinto displays a deep ruby red color, hinting at the depth and intensity that awaits. On the nose, it reveals an enticing bouquet of ripe dark fruits, such as blackberries and plums, mingling harmoniously with subtle hints of spice, tobacco, and cedar. This aromatic complexity sets the stage for an enticing tasting experience.
Upon the first sip, the Lutra Tinto unve",Wine,5601766400025,hidden,Prepared food and beverage,N,N,Y,Y,14.00,N,N,6,0,Y,12,N,N
#r-g-cheese-makers-garlic-and-herb-chevre-regular,ROP7Z56TUACZBBEMQMK2B2NP,R & G Cheese Makers Garlic and Herb Chevre,Regular,NA,683720204011,NA,FOOD,683720204011,visible,Prepared food and beverage,NA,NA,NA,NA,6.00,N,NA,3.08,0,NA,NA,N,N
#r-g-cheese-makers-plain-chevre-regular,7LJVDD2JJCJQ56VWLWOFW37T,R & G Cheese Makers Plain Chevre,Regular,NA,683720203991,NA,FOOD,683720203991,visible,Prepared food and beverage,NA,NA,NA,NA,6.00,N,NA,3.08,0,NA,NA,N,N
#raats-chenin-blanc-regular,K34RLL3SZED277RIF24LCWQK,Raats Chenin Blanc,Regular,NA,NA,Bin 220,Wine,855200000028,visible,Prepared food and beverage,N,N,Y,Y,24.00,N,N,18,11,Y,12,N,N
#racines-california-pinot-noir-regular,6KBGNIBJXIYUYJVTCNA7TMWW,Racines California Pinot Noir,Regular,NA,NA,Bin 255,Wine,NA,visible,Prepared food and beverage,N,N,Y,Y,110.00,N,N,75,10,N,5,N,N
#rainbow-trout-smoked-caviar-regular,BSOI47MHL3AUOS7XET4ME5OO,Rainbow Trout Smoked Caviar,Regular,NA,NA,NA,Tinned Fish,NA,hidden,Prepared food and beverage,NA,NA,Y,Y,32.00,N,N,21.33,0,NA,NA,N,N
#raincoast-crisp-cranberry-cracker-regular,FWOCYGM3QURTU2KQT6ZQCS2Y,Raincoast Crisp Cranberry Cracker,Regular,NA,061243710750,NA,FOOD,855565002057,hidden,Prepared food and beverage,N,N,Y,Y,11.00,N,N,8.1,6,Y,12,N,N
#raincoast-crisps-with-blueberry-and-almond-crackers-regular,AT2SVD4PMPEWZRLTIMXUZVKP,Raincoast Crisps With Blueberry And Almond Crackers,Regular,NA,061243718107,NA,FOOD,NA,visible,Physical good,NA,NA,NA,NA,11.00,N,NA,7.31,0,NA,NA,N,N
#raisin-libre-regular,S3X5RMAJROTBFCHMXSHIFQHE,Raisin Libre,Regular,NA,raisin,NA,Wine,NA,visible,Prepared food and beverage,N,N,Y,Y,28.00,N,N,19,6,Y,4,N,N
#rambo-radish-microgreens-regular,XRLNS24O7M3B5CNAK3GHMUHQ,Rambo Radish Microgreens,Regular,NA,NA,NA,FOOD,NA,visible,Prepared food and beverage,NA,NA,Y,Y,7.00,N,NA,4,3,NA,NA,N,N
#ramen-bowl-regular,B5LUQQNWKO7O6LZP3QBHMNPB,Ramen Bowl,Regular,NA,9407762,NA,Pottery,NA,visible,Prepared food and beverage,NA,NA,NA,Y,30.00,N,NA,NA,2,NA,NA,N,Y
#ramey-chardonnay--regular,35OQBTR2PPRGMMWGXV7X6DIT,Ramey (Chardonnay),Regular,NA,7632749,"Bin 76
Ramey is a California winery renowned for producing high-quality Chardonnay wines. The winery is located in Healdsburg, Sonoma County, which is known for its diverse soil types and maritime climate. These factors contribute to the unique character of Ramey's Chardonnay.
The winemaking philosophy of Ramey is centered around the concept of terroir, or the influence of the environment on the wine. The grapes used for their Chardonnay are sourced from several different vineyards, each with its own distinct soil composition and microclimate. This allows the winemaker to create a blend of Chardonnay that represents the best of each terroir.
The grapes are hand-harvested and sorted before being gently pressed, and the juice is fermented using native yeasts. The wine is aged in French oak barrels for 12-18 months, during which time it undergoes malolactic fermentation. This process helps to soften the acidity and impart a creamy texture to the wine.
Ramey's Chardonnay is characterized by its complex aroma of c",Wine,185983000053,visible,Prepared food and beverage,N,N,N,Y,49.00,N,N,26.67,28,Y,5,N,N
#rascal-mcgrath-regular,WAYUJGJ652OPTDRW37HWXQTH,Rascal Mcgrath,Regular,NA,RM,NA,FOOD,NA,visible,Prepared food and beverage,NA,NA,Y,Y,14.00,N,N,9.65,0,NA,NA,N,N
#red-jacket-orchards-apple-cider-regular,BOIMSOOBGZ5EM7FUIXBAYVGM,Red Jacket Orchards Apple Cider,Regular,NA,043519000208,NA,Alcohol-Free,043519000208,visible,Prepared food and beverage,NA,NA,NA,NA,4.00,N,NA,2,0,NA,NA,N,N
#red-jacket-orchards-fuji-apple-juice-regular,OO6SZK5X7SLYSECEGZULWKLX,Red Jacket Orchards Fuji Apple Juice,Regular,NA,043519000383,NA,Alcohol-Free,043519000383,visible,Prepared food and beverage,NA,NA,NA,NA,4.00,N,NA,2,33,NA,NA,N,N
#red-jacket-orchards-juice-strawberry-regular,AUR327OMBRCQADP73DBRAX5L,"Red Jacket Orchards, Juice Strawberry",Regular,NA,043519000468,NA,Alcohol-Free,043519000468,visible,Prepared food and beverage,NA,NA,NA,NA,4.00,N,NA,2,24,NA,NA,N,N
#red-jacket-orchards-juice-summer-blend-regular,4J6WHGYJPKWT3OKU7PPN4JZB,"Red Jacket Orchards, Juice Summer Blend",Regular,NA,043519000963,NA,Alcohol-Free,043519000963,visible,Prepared food and beverage,NA,NA,NA,NA,4.00,N,NA,2,15,NA,NA,N,N
#red-pepper-jelly-regular,NULGMBEDUF5G3HXB4Z5ZYLCW,Red Pepper Jelly,Regular,NA,NA,"A perennial favourite!

Our Red Pepper Jelly perfectly balances the sweetness of ripe red peppers with the zesty heat of Scotch Bonnet Peppers. Pair with cream cheese and crackers for an easy, delicious appetizer. Serve with a full-bodied Pinot Noir or Cabernet Franc.

5.3oz mL recyclable glass jar
2 year shelf life
Store in a cool, dry place
Refrigerate after opening
RSP: $5.99

Orders being shipped to the US will require an EIN ( Employer Identification Number) in order to proceed with the order/shipping.",NA,NA,visible,Prepared food and beverage,NA,NA,NA,NA,5.99,N,NA,NA,0,NA,NA,N,N
#red-pomodoro-soup-regular,2HAB3YICXLBXZ3MLAIBVXUZ5,Red Pomodoro soup,Regular,NA,488954L,NA,FOOD,195893466559,hidden,Prepared food and beverage,NA,NA,NA,Y,11.00,N,NA,NA,0,NA,NA,N,N
#remelluri-rioja-tempranillo-malvasia-grenache-graciano-viura--regular,ZJPLAEJK64TOWFBCNNBEZDPK,Remelluri Rioja (Tempranillo/Malvasia/Grenache/Graciano/Viura),Regular,NA,K029343,"Bin 206

Remelluri Rioja is a Spanish winery that produces a unique blend of Tempranillo, Malvasia, Grenache, Graciano, and Viura grapes. The winery is located in the Rioja Alavesa region, which is known for its high-quality wines and distinctive terroir.
The grapes used for Remelluri Rioja are sourced from several different vineyards, each with its own soil composition and microclimate. The Tempranillo grape, which is the backbone of the blend, is known for its tannins and flavors of dark fruit, while the Malvasia, Grenache, Graciano, and Viura grapes add complexity and balance to the wine.
The winemaking process at Remelluri Rioja is a blend of traditional and modern techniques. The grapes are hand-harvested and sorted before being fermented in stainless steel tanks. The wine is then aged in a combination of French and American oak barrels for up to 18 months, during which time it undergoes malolactic fermentation. This process helps to soften the acidity and impart a creamy texture to the wine.
Remelluri R",Wine,664841014000,visible,Prepared food and beverage,NA,NA,N,Y,49.00,N,N,35,12,Y,5,N,N
#rezabal-txakoli-blanco-regular,3AGXWKUHINOEGTU4M2PVT6BT,Rezabal Txakoli Blanco,Regular,NA,8437008335018,Bin 225,Wine,NA,visible,Prepared food and beverage,N,N,Y,Y,20.00,N,N,16,6,Y,5,N,N
#rezabal-txakoli-ros--regular,QNEAIPZQMJAIIX3IRXMEH2YK,Rezabal Txakoli Rosé,Regular,NA,NA,Bin 224,Wine,8437008335032,visible,Prepared food and beverage,NA,NA,Y,Y,20.00,N,N,16,6,Y,5,N,N
#rillettes-country-style-duck-spread-regular,ECFJ2QL4QT4PPGX6HA2FF32G,Rillettes Country Style Duck Spread,Regular,NA,NA,NA,FOOD,736622103354,NA,Prepared food and beverage,NA,NA,NA,NA,16.00,N,NA,10.22,0,NA,NA,N,N
#rioja-senorio-de-p-pecina-cosecha-regular,YENZND2EMZHWGOH2UZW32CCJ,Rioja Senorio De P. Pecina Cosecha,Regular,NA,182515000819,Bin 87,Wine,NA,unavailable,Physical good,N,N,N,N,18.00,N,N,8.3,21,NA,NA,N,N
#rioja-senorio-de-p-pecina-crianza-regular,7CTCDVBQIP5YHIXEJ4R3ZMEB,Rioja Senorio De p. Pecina Crianza,Regular,NA,182515000628,Bin 172,Wine,NA,NA,Prepared food and beverage,N,N,Y,Y,20.00,N,N,14.67,14,Y,5,N,N
#ritual-gin-alternative-zero-proof-non-alcoholic-regular,ZGPC6FGJCV3Z4DBBB6PZBGYI,Ritual Gin Alternative - Zero Proof - Non-Alcoholic,Regular,NA,NA,NA,Alcohol-Free,850005389002,visible,Physical good,NA,NA,NA,NA,29.00,N,NA,19.25,0,NA,NA,N,N
#ritual-tequila-alternative-zero-proof-regular,HL65BADBPHCRBUF6OIXL77HJ,Ritual Tequila Alternative - Zero Proof,Regular,NA,NA,NA,Alcohol-Free,850005389057,visible,Physical good,NA,NA,NA,NA,29.00,N,NA,19.25,0,NA,NA,N,N
#ritual-zero-proof-aperitif-alternative-award-winning-regular,PM7NXGRXDQS6BSVAQYDNFT7C,Ritual Zero Proof Aperitif Alternative | Award-Winning,Regular,NA,NA,NA,Alcohol-Free,850005389330,visible,Physical good,NA,NA,NA,NA,29.00,N,NA,19.25,0,NA,NA,N,N
#ritual-zero-proof-rum-alternative-award-winning-non-alcoholic-spirit--regular,A4TC5VBSWNG7HHXXASVVZTC5,Ritual Zero Proof Rum Alternative | Award-Winning Non-Alcoholic Spirit |,Regular,NA,850005389088,NA,Alcohol-Free,NA,visible,Physical good,NA,NA,NA,NA,29.00,N,NA,19.25,4,NA,NA,N,N
#ritual-zero-proof-whiskey-alternative-a-non-alcoholic-alternative-echoes-the-flavor-warmth-of-american-whiskey--regular,AL46PI7IIXNAEBSDUNK5L2BY,Ritual Zero Proof Whiskey Alternative | A Non-Alcoholic Alternative | Echoes The Flavor Warmth of American Whiskey |,Regular,NA,NA,NA,Alcohol-Free,850005389026,visible,Physical good,NA,NA,NA,NA,29.00,N,NA,19.25,1,NA,NA,N,N
#rivera-del-notro-blanco-2021-regular,VZSA3IXINU6FGLUMJPVRK7SC,Rivera del Notro Blanco 2021,Regular,NA,850032851213,"Roberto Henriquez 'Rivera del Notro' Bianco is a Chilean white wine produced by the eponymous winemaker Roberto Henriquez. The wine is made from a blend of several grape varieties, including Moscatel, Corinto, and Torontel, all of which are native to Chile.
The grapes for this wine are grown in the Bio Bio Valley, located in southern Chile, which is known for its cool climate and granite soil. The grapes are harvested by hand and fermented in clay amphorae, a traditional winemaking method that is experiencing a revival in Chile. The wine is then aged in these amphorae for 12 months, allowing it to develop its unique character and complexity.
Roberto Henriquez 'Rivera del Notro' Bianco is characterized by its floral and citrusy aroma, with hints of apricot, peach, and honey. On the palate, it is rich and full-bodied, with flavors of ripe fruit and a subtle minerality. The wine has a smooth texture and a long, lingering finish, which reflects the quality of the grapes and the skill of the winemaker.
This wine i",Wine,NA,visible,Prepared food and beverage,N,N,N,Y,25.00,N,N,20,6,N,5,N,N
#roberto-henriquez-rivera-del-notro-tinto-regular,V5GVHY2EFT7NXOSEICXHM5JY,Roberto Henriquez 'Rivera del Notro' Tinto,Regular,NA,NA,"Rivera del Notro Tinto is a Chilean red wine produced by Roberto Henriquez, a winemaker who is known for his commitment to organic and biodynamic farming practices. The wine is made from a blend of several grape varieties, including País, Cinsault, and Carignan, all of which are native to Chile.
The grapes for this wine are grown in the Bío Bío region of southern Chile, which is known for its cool climate and granite soil. The grapes are hand-harvested and fermented using indigenous yeasts in clay amphorae, a traditional winemaking method that dates back to ancient times. The wine is then aged in these amphorae for 12 months, allowing it to develop its unique character and complexity.
Rivera del Notro Tinto is a medium-bodied red wine with aromas of ripe red fruit, including cherries and raspberries, with hints of spice and earth. On the palate, it is smooth and well-balanced, with flavors of red fruit, tobacco, and a subtle minerality. The wine has a long, lingering finish that reflects the quality of the gr",Wine,850032851046,visible,Prepared food and beverage,NA,NA,N,Y,25.00,N,N,20,2,N,0,N,N
#robin-s-egg-caramels-sugarfina-regular,VIZI7LOLIMICVHLJ5JWEJX2L,Robin's Egg Caramels Sugarfina,Regular,NA,840278113671,NA,FOOD,NA,hidden,Prepared food and beverage,NA,NA,Y,Y,9.00,N,NA,5.42,0,NA,NA,N,N
#rochefort-trappist-ale-8-regular,EUVVKSKJYBXOIN6VVMV4CJ4A,Rochefort Trappist Ale 8,Regular,NA,NA,NA,Beer,085725165012,hidden,Prepared food and beverage,NA,NA,NA,Y,6.00,N,NA,3.8,0,N,0,N,N
#rocky-lands-chardonnay-regular,7Q3W7LLYFVGRQ3FXCJ62K2EH,Rocky Lands Chardonnay,Regular,NA,NA,Bin 253,Wine,6003706001917,unavailable,Prepared food and beverage,N,N,N,N,19.00,N,N,11.33,40,Y,24,N,N
#rolling-rock-extra-pale-6-pk-regular,HHXMYACV5GRWJLNPLKGUZRVI,Rolling Rock Extra Pale  6 pk,Regular,NA,NA,NA,Beer,071439348063,unavailable,Prepared food and beverage,N,N,N,N,10.00,N,N,6,0,NA,NA,N,N
#rombauer-carneros-chardonnay--regular,ZV2OBSVEH5ETA37GOXNXD3RD,Rombauer Carneros (Chardonnay),Regular,NA,6716895,"Bin 245 Rombauer Vineyards Chardonnay is a California white wine known for its rich and buttery flavor profile. The grapes for this wine are grown in the Carneros region of Napa Valley and the cooler regions of Sonoma County, where the fog from the nearby Pacific Ocean creates ideal growing conditions for Chardonnay.
The wine is fermented in a combination of French and American oak barrels, where it undergoes partial malolactic fermentation. This process imparts the wine with a creamy texture and buttery notes, which are complemented by flavors of tropical fruit, baked apple, and vanilla.
Rombauer Vineyards Chardonnay is a full-bodied wine with a smooth and balanced finish. It is characterized by its complex layers of flavor, with a rich and luxurious mouthfeel that is a hallmark of the best California Chardonnays. The wine is best served chilled, and it pairs well with a variety of dishes, including roasted chicken, seafood, and creamy pasta dishes.
Overall, Rombauer Vineyards Chardonnay is a wine that combines the",Wine,097921970109,visible,Prepared food and beverage,N,N,N,Y,54.00,N,N,39.98,20,Y,12,N,N
#rombauer-vineyards-zinfandel-regular,QLFOVH4H47F66IJRPMXKLNEY,Rombauer Vineyards Zinfandel,Regular,NA,097921978105,Bin 254,Wine,097921978105,unavailable,Prepared food and beverage,N,N,N,N,39.00,N,N,28,5,Y,5,N,N
#ronnybrook-butter-salted-regular,JCFFIVHOHGEKGNWN3EXSCJYJ,"Ronnybrook Butter, Salted",Regular,NA,NA,NA,FOOD,746104160010,visible,Prepared food and beverage,NA,NA,NA,NA,8.00,N,NA,5.45,1,NA,NA,N,N
#ronnybrook-unsalted-butter-regular,Q7HD4XN3FPXH6E4SWXOG4AGJ,Ronnybrook Unsalted Butter,Regular,NA,746104160003,NA,FOOD,746104160003,visible,Prepared food and beverage,NA,NA,NA,NA,8.00,N,NA,5.45,5,NA,NA,N,N
#rosemary-maple-mix-regular,FRM5WPWJEL66LI57NMD6ZZZA,Rosemary & Maple Mix,Regular,NA,094922666666,NA,FOOD,NA,hidden,Prepared food and beverage,N,NA,NA,Y,6.00,N,N,2.8,0,NA,NA,N,N
#rosemary-marcona-almonds-regular,Q3RYIPXRQINKW4FXOWUKK72B,Rosemary Marcona Almonds,Regular,NA,817944010770,NA,FOOD,NA,NA,Physical good,NA,NA,NA,NA,9.00,N,NA,6.26,0,NA,NA,N,N
#rosewood-board-regular,VSARSJVT42JY3B2PLPSZWFLQ,Rosewood Board,Regular,NA,4995741,NA,Cutting boards,NA,hidden,Prepared food and beverage,N,N,N,Y,85.00,N,N,85,0,NA,NA,N,N
#roth-gouda-cheese-regular,PSSZAVN4GCF7QUQDAEDDYEQR,Roth Gouda Cheese,Regular,NA,RGC,NA,FOOD,NA,visible,Prepared food and beverage,NA,NA,NA,NA,10.00,N,NA,NA,4,NA,NA,N,Y
#round-vase-regular,EVF67OGKYHEGUDRRCUHOMTQD,Round Vase,Regular,NA,N950876,NA,Pottery,NA,hidden,Prepared food and beverage,NA,NA,NA,Y,75.00,N,NA,NA,0,NA,NA,N,Y
#rustichella-d-abruzzo-fusilli-regular,SCG3PF355JQQ2U5XCRRKXHOI,Rustichella D'Abruzzo Fusilli,Regular,NA,NA,NA,FOOD,NA,unavailable,Prepared food and beverage,N,N,N,N,7.00,N,N,3.95,0,NA,NA,N,N
#rustichella-d-abruzzo-bucatini-pasta-regular,5NGQBV3BUKYZ2NRM6YLZ5DHM,Rustichella d'Abruzzo Bucatini Pasta,Regular,NA,NA,NA,FOOD,793232111292,hidden,Prepared food and beverage,NA,NA,Y,Y,7.00,N,NA,4.02,0,NA,NA,N,N
#rustichella-d-abruzzo-duru-wheat-linguine-pasta-regular,LUSAWDBUQ63PPYGUF3J7Q4GK,Rustichella d'Abruzzo Duru Wheat Linguine Pasta,Regular,NA,793232111025,NA,FOOD,793232111025,NA,Prepared food and beverage,NA,NA,NA,NA,7.00,N,NA,4.05,0,NA,NA,N,N
#rustichella-d-abruzzo-durum-wheat-fusilli-pasta-regular,Y6SD3RG3ZNSFXAVU7QDCNP6A,Rustichella d'Abruzzo Durum Wheat Fusilli Pasta,Regular,NA,NA,NA,FOOD,793232111155,unavailable,Prepared food and beverage,N,N,N,N,7.00,N,N,4,0,NA,NA,N,N
#rustichella-d-abruzzo-organic-gluten-free-brown-rice-penne-rigate-regular,GAIBFZ4JE7LZZJPRN4G7K4Y2,Rustichella d'Abruzzo Organic Gluten-Free Brown Rice Penne Rigate,Regular,NA,793232227214,NA,FOOD,793232227214,NA,Prepared food and beverage,NA,NA,NA,NA,7.00,N,NA,4.55,3,NA,NA,N,N
#scout-atlantic-canadian-lobster-regular,LYMBFI2Y6M67H4DXGZKPKIQB,SCOUT Atlantic Canadian Lobster,Regular,NA,NA,NA,Tinned Fish,627987271447,hidden,Prepared food and beverage,NA,NA,Y,Y,15.00,N,N,9.74,0,NA,NA,N,N
#saison-dupont-belgian-farmhouse-ale-beer-regular,JKGUNCIRKZLSOP7DXZI4GVYH,Saison Dupont Belgian Farmhouse Ale Beer,Regular,NA,NA,"Bin 1 Indulge in the exquisite taste of Saison Dupont Belgian Farmhouse Ale Beer. Crafted using traditional brewing methods, this authentic Belgian ale offers rich and complex flavors that will take your beer-drinking experience to the next level. Don't miss out on this unique and delicious brew - add it to your cart now!",Beer,792098052343,unavailable,Prepared food and beverage,N,N,N,N,14.00,N,N,9.58,20,NA,NA,N,N
#saloio-portugese-olive-oil-946ml-regular,VPZC34EFZ4FZSBC7V2RO6DR3,Saloio Portugese Olive Oil - 946ml,Regular,NA,5603952001054,NA,FOOD,5603952001054,visible,Prepared food and beverage,NA,NA,NA,NA,20.00,N,NA,15.99,3,NA,NA,N,N
#salt-twine-mezcal-salted-lime-regular,F6LABBJ3MSIPZWEAUSTZETLO,Salt & Twine Mezcal & Salted Lime,Regular,NA,NA,NA,FOOD,816746020048,visible,Prepared food and beverage,NA,NA,NA,NA,10.00,N,NA,5.75,0,NA,NA,N,N
