#iuli-natalin-grignolino--regular,3J5VTK6JCCP47JNVPPHSXXL6,Iuli 'Natalin' (Grignolino),Regular,NA,1685632,"Bin 147
like a party in a bottle - and I don't mean one of those boring dinner parties on Buckley St. where everyone sits around talking about the weather. I'm talking about a wild, crazy, no-holds-barred rager that you'll never forget.
One sip of Iuli Natalin and you'll feel like you're dancing on the table at the British Maid, singing at the top of your lungs, and wearing a lampshade on your head (even if you're actually just sitting quietly at home in your pajamas).
It's the kind of wine that makes you want to call up your ex and tell them how much you miss them, even though you know it's a terrible idea. And when you wake up the next morning with a headache and a vague sense of regret, you'll still be glad you tried it - because let's face it, life is too short to drink boring wine.",Wine,8052400330043,visible,Prepared food and beverage,N,N,N,Y,21.00,N,N,16,13,N,5,N,N
#jacuterie-sliced-salami-regular,JAL3H6GUWVBUXQSWVGUQZNOE,Jacuterie Sliced Salami,Regular,NA,860003898420,NA,FOOD,NA,visible,Prepared food and beverage,NA,NA,NA,NA,8.00,N,NA,4.97,0,NA,NA,N,N
#jake-s-aged-gouda-regular,GYJH7RHO5JZ2WXLQNYXC5XEZ,Jake's Aged Gouda,Regular,NA,JAG,NA,FOOD,NA,NA,Prepared food and beverage,NA,NA,NA,NA,14.00,N,NA,6.48,5,NA,NA,N,N
#jake-s-baby-gouda-regular,B2LQA5LFEE6FRCT4N3ZS7VM7,Jake's Baby Gouda,Regular,NA,BG,NA,FOOD,NA,visible,Prepared food and beverage,NA,NA,N,Y,12.00,N,N,7.53,0,Y,4,N,N
#jake-s-smoked-gouda-regular,QHGWQYZVNB6BNTCLE447JYPH,Jake's Smoked Gouda,Regular,NA,sg,NA,FOOD,NA,visible,Prepared food and beverage,NA,NA,N,Y,15.00,N,N,8,4,Y,6,N,N
#jakes-sharp-cheddar-regular,YWJ5EUOYMQKDDND277AXNRGU,Jakes Sharp Cheddar,Regular,NA,NA,NA,FOOD,NA,visible,Prepared food and beverage,NA,NA,NA,NA,11.00,N,NA,7.16,0,NA,NA,N,N
#jalape-o-shrub-regular,H4PLKYJJFWSRCEOM5WGPKXGI,Jalapeño Shrub,Regular,NA,JS,NA,Alcohol-Free,NA,visible,Prepared food and beverage,NA,NA,NA,NA,16.00,N,NA,12,2,NA,NA,N,N
#jasper-hill-alpha-tolman-regular,3GWPFVSKTBLZHSCNVKFVW5OR,Jasper Hill Alpha Tolman,Regular,Pound 1.00,10010,NA,Cheese,NA,visible,Physical good,NA,NA,NA,NA,35.00,N,NA,22.29,-2.28,NA,NA,N,N
#jasper-hill-cabot-clothbound-regular,UPPVCVZBQ3A4MLBGO3AMHCOW,Jasper Hill Cabot Clothbound,Regular,Pound 1.00,10020,NA,Cheese,NA,unavailable,Physical good,NA,NA,NA,NA,29.00,N,NA,19.14,4.16,NA,NA,N,N
#jasper-hill-farm-5-oz-harbison-petite-bloomy-rind-cheese-with-spruce-bark-regular,3LVTRE44QHNJNXS6EL7IYKYF,Jasper Hill Farm (5 Oz) Harbison Petite Bloomy Rind Cheese with Spruce Bark,Regular,NA,814836022002,NA,FOOD,NA,visible,Prepared food and beverage,NA,NA,NA,Y,12.00,N,N,7.37,11,Y,10,N,N
#jasper-hill-farm-cabot-clothbound-mature-cheddar-cheese-with-sweet-nutty-flavors-regular,6DLL7CQCTHDJRNANL4I2H7QC,Jasper Hill Farm Cabot Clothbound Mature Cheddar Cheese with Sweet & Nutty Flavors,Regular,NA,154846,NA,FOOD,NA,hidden,Prepared food and beverage,N,N,N,Y,10.00,N,N,6.5,0,Y,8,N,N
#jasper-hill-farm-little-hosmer-bloomy-rind-regular,K5BCIIVNMBXGA3G3SVFQHUSA,Jasper Hill Farm Little Hosmer Bloomy Rind,Regular,NA,814836020695,NA,FOOD,NA,visible,Prepared food and beverage,NA,NA,N,Y,10.00,N,N,5.53,10,Y,8,N,N
#jasper-hill-farm-sherry-gray-regular,QHWJ67LFQCNCD6ZK7V2SBCEO,Jasper Hill Farm Sherry Gray,Regular,NA,814836022187,NA,FOOD,814836022187,hidden,Prepared food and beverage,N,N,Y,Y,20.00,N,N,13.19,0,Y,8,N,N
#jasper-hill-farm-vault-no-5-sweet-melty-cheddar-regular,VJ6UL5ZT7X73IVCDTEAYYZ4Y,Jasper Hill Farm Vault No. 5 Sweet & Melty Cheddar,Regular,NA,814836021647,NA,FOOD,NA,visible,Prepared food and beverage,NA,NA,NA,Y,9.00,N,N,5.88,16,Y,6,N,N
#jasper-hill-farm-willoughby-washed-rind-soft-cheese-regular,T2FW7HFB7SSV7AB6FO773HCN,Jasper Hill Farm Willoughby Washed Rind Soft Cheese,Regular,NA,814836020046,NA,FOOD,NA,visible,Prepared food and beverage,N,N,N,Y,18.00,N,N,12.71,0,Y,8,N,N
#jasper-hill-vault-5-regular,5XVNOWDZCIPBZTWITQMP4NVB,Jasper Hill Vault 5,Regular,Pound 1.00,10040,NA,FOOD,NA,visible,Physical good,NA,NA,NA,NA,24.00,N,NA,NA,0.3,NA,NA,N,N
#jasper-hill-whitney-regular,C4UZN5NXOLHBUMNELVIYT56X,Jasper Hill Whitney,Regular,NA,NA,NA,Cheese,814836022163,visible,Prepared food and beverage,N,N,N,Y,11.00,N,N,6.5,0,NA,NA,N,N
#jasper-hill-whitney-1-regular,I2F2HDKSWDK3BOYIG5LNA4XJ,Jasper Hill Whitney,Regular,Pound 1.00,10030,NA,Cheese,NA,visible,Physical good,NA,NA,NA,NA,33.00,N,N,20.87,-0.04,NA,NA,N,N
#jeff-dalzell-cards-regular,O4WBBY2NM3RC2E3OOPUTN34Y,Jeff Dalzell Cards,Regular,NA,547401Z,NA,Cards,NA,visible,Prepared food and beverage,NA,NA,NA,Y,5.00,N,NA,NA,202,NA,NA,N,Y
#jersey-girl-cheese-regular,G5GBAOFQV3BMUVXNSWUQWCLV,Jersey Girl Cheese,Regular,NA,NA,NA,FOOD,NA,visible,Prepared food and beverage,NA,NA,NA,NA,12.00,N,NA,8.48,0,NA,NA,N,Y
#john-kay-print-regular,N3QO4IUFSO32IX3DNOGUAELR,John Kay Print,Regular,NA,NA,NA,Art,NA,visible,Prepared food and beverage,NA,NA,NA,NA,30.00,N,NA,NA,0,NA,NA,N,Y
#jose-gourmet-sardines-in-extra-virgin-olive-oil-4-4-oz-regular,6MKZX7C2HZKPYNFPPN7TMW6G,Jose Gourmet - Sardines in Extra Virgin Olive Oil - 4.4 oz,Regular,NA,NA,NA,FOOD,5600409200305,NA,Physical good,NA,NA,NA,NA,9.00,N,NA,5.27,0,NA,NA,N,N
#jose-gourmet-small-mackerel-in-olive-oil-regular,SIJ64ZZCHP6CTNRI2IEV6YJX,Jose Gourmet Small Mackerel in Olive Oil,Regular,NA,5600409200459,NA,Tinned Fish,5600409200459,visible,Physical good,NA,NA,NA,NA,14.00,N,NA,6.47,0,NA,NA,N,N
#jose-gourmet-smoked-sardines-in-extra-virgin-olive-oil-regular,BSAXQRPBXQBTDTA7W2ZC7Y3O,Jose Gourmet Smoked Sardines in Extra Virgin Olive Oil,Regular,NA,NA,NA,FOOD,5600409202811,NA,Physical good,NA,NA,NA,NA,9.00,N,NA,5.93,1,NA,NA,N,N
#jose-gourmet-smoked-small-sardines-in-olive-oil-regular,U73EGKNPUDHQFMMTBEMZXRL5,Jose Gourmet Smoked Small Sardines in Olive Oil,Regular,NA,NA,NA,FOOD,5600409200442,NA,Physical good,NA,NA,NA,NA,9.00,N,NA,5.93,0,NA,NA,N,N
#jose-gourmet-smoked-trout-fillets-in-olive-oil-regular,4LN7OBLZ3MT5XV4LD22AD7KB,Jose Gourmet Smoked Trout Fillets in Olive Oil,Regular,NA,NA,NA,FOOD,5600409201203,NA,Physical good,NA,NA,NA,NA,14.00,N,NA,9.23,4,NA,NA,N,N
#jose-gourmet-spiced-small-sardines-regular,JQSMUVX6IEDB67FKS5D5AZKR,Jose Gourmet Spiced Small Sardines,Regular,NA,NA,NA,FOOD,5600409200336,NA,Physical good,NA,NA,NA,NA,9.00,N,NA,5.27,2,NA,NA,N,N
#jose-gourmet-spiced-tuna-pat--regular,QD3VUV5VOU7ZFV55WNE2ASTS,Jose Gourmet Spiced Tuna Paté,Regular,NA,5600409200978,NA,Tinned Fish,5600409200978,NA,Physical good,NA,NA,NA,NA,11.00,N,NA,4.33,0,NA,NA,N,N
#jose-gourmet-tuna-pate--regular,FPDUAXH7PHMGHFPTV4WTTUCZ,Jose Gourmet Tuna Paté,Regular,NA,5600409200909,NA,Tinned Fish,5600409200909,visible,Physical good,NA,NA,NA,NA,11.00,N,NA,4.33,0,NA,NA,N,N
#jose-spiced-small-mackerel-in-olive-oil-regular,JTKQA2PAGJ3QMV652RNOA4ND,Jose Spiced Small Mackerel In Olive Oil,Regular,NA,5600409202354,NA,Tinned Fish,NA,visible,Physical good,NA,NA,NA,NA,14.00,N,NA,6.47,0,NA,NA,N,N
#josh-cabernet-sauvignon-dsc--regular,H6V3AICDV7NTMEUHFI4SN43O,Josh (Cabernet Sauvignon) (DSC),Regular,NA,NA,DSC,Wine,857744001318,unavailable,Prepared food and beverage,N,N,N,Y,18.00,Y,N,13,0,Y,12,N,N
#josh-merlot-dsc-regular,43ZRM2IKGXSBTWTXQODZHPDE,Josh (Merlot) DSC,Regular,NA,NA,DSC,Wine,857744011157,visible,Prepared food and beverage,N,N,N,Y,18.00,N,N,13,2,Y,5,N,N
#joto-sake-one-cup-grafiti-cup--regular,OZ4ATSQK7FBAS5TVGIOT6FGP,"Joto Sake One Cup ""Grafiti Cup""",Regular,NA,NA,NA,Wine,850176001086,NA,Prepared food and beverage,N,N,Y,Y,6.00,N,N,3,0,N,0,N,N
#julien-sunier-fleurie-gamay--regular,45AMXFT4JEDJSUME66LPTHJB,Julien Sunier Fleurie (Gamay),Regular,NA,Y612170,"Bin 103
Julien Sunier Fleurie is a red wine made from Gamay grapes grown in the Fleurie appellation of Beaujolais, France. The wine is produced by Julien Sunier, a young winemaker known for his minimalist approach to winemaking and his commitment to organic and biodynamic farming practices.
The Fleurie appellation is known for producing some of the most elegant and aromatic wines in Beaujolais, and Sunier's Fleurie is no exception. The wine is light and fruity, with flavors of red berries, cherries, and violets, and a subtle earthy undertone. It has a smooth and silky texture, with well-integrated tannins and a refreshing acidity.
Sunier's winemaking philosophy is based on respecting the natural character of the grapes and the terroir, and his Fleurie reflects this approach. The grapes are harvested by hand and fermented with native yeasts, with minimal intervention during the winemaking process. The wine is then aged in oak barrels for a few months before bottling, allowing it to develop its complex and nuan",Wine,3760248250021,visible,Prepared food and beverage,N,N,N,Y,37.00,N,N,25,0,Y,12,N,N
#julien-sunier-morgon-regular,FNGQHJEOHRULHCF27R3SUHFF,Julien Sunier Morgon,Regular,NA,morgon,"Bin 103, same as Julien Sunier Fleurie. Beaujolais.",NA,NA,visible,Prepared food and beverage,NA,NA,NA,NA,37.00,N,NA,25,9,NA,NA,N,N
#jupiter-skinless-boneless-sardines-in-organic-olive-oilp-regular,GVFBQNFVX6ZYEDHZAXOI4WHZ,Jupiter Skinless & Boneless Sardines in Organic Olive Oilp,Regular,NA,5601721816021,NA,FOOD,5601721816021,visible,Prepared food and beverage,NA,NA,NA,NA,8.00,N,NA,48,4,NA,NA,N,N
#jupiter-tuna-belly-in-organic-olive-oil-regular,FKPQBEYK6AZP62QHAT2UQSLU,Jupiter Tuna Belly in Organic Olive Oil,Regular,NA,5601721816045,NA,FOOD,NA,visible,Physical good,NA,NA,NA,NA,14.00,N,NA,11.19,2,NA,NA,N,N
#justin-cabernet-sauvignon--regular,IV7BBSOQ3FHF4B33EFPBDMLE,Justin (Cabernet Sauvignon),Regular,NA,NA,Bin 9,Wine,733952997103,visible,Prepared food and beverage,N,N,N,Y,29.00,N,N,20,16,Y,5,N,N
#kale-shrub-regular,SOCPEGVTGOK56K7BJEWBJTXN,Kale Shrub,Regular,NA,PKS,NA,Alcohol-Free,NA,visible,Physical good,NA,NA,NA,NA,16.00,N,NA,12,3,NA,NA,N,N
#kansas-city-banana-peppers-regular,7IM67V22LGQDHCL7HJONRIGG,Kansas City Banana Peppers,Regular,NA,NA,NA,FOOD,604348881750,visible,Physical good,NA,NA,NA,NA,9.00,N,NA,5.4,7,NA,NA,N,N
#kansas-city-canning-co-cucumber-dilly-pickles-regular,ONZNAKRQBZHLH22N4CB6J6VL,Kansas City Canning Co. Cucumber Dilly Pickles,Regular,NA,604348881262,NA,FOOD,NA,visible,Prepared food and beverage,NA,NA,NA,Y,12.00,N,N,7.2,-1,Y,6,N,N
#kansas-city-canning-co-heirloom-tomato-bruschetta-regular,EU6DNSQQ7JSPAM7RM3OJQJU3,Kansas City Canning Co. Heirloom Tomato Bruschetta,Regular,NA,604348881040,NA,FOOD,NA,hidden,Prepared food and beverage,NA,NA,NA,Y,14.00,N,N,8.4,-6,Y,6,N,N
#kansas-city-canning-co-onion-jam-regular,DYEY66IJS7AWYXS7MVYTNFWI,Kansas City Canning Co. Onion Jam,Regular,NA,604348881774,NA,FOOD,604348881774,visible,Prepared food and beverage,NA,NA,NA,NA,9.00,N,NA,5.4,0,NA,NA,N,N
#kansas-city-canning-co-pickled-green-tomatoes-regular,ON33LXMU23M7UYYS77BKZ274,Kansas City Canning Co. Pickled Green Tomatoes,Regular,NA,604348881088,NA,FOOD,NA,visible,Prepared food and beverage,NA,NA,NA,Y,14.00,N,N,8.4,1,Y,6,N,N
#kansas-city-canning-co-pickled-red-onion-regular,ID4QGTJMF57NLUWVR5ZDXO74,Kansas City Canning Co. Pickled Red Onion,Regular,NA,604348881880,NA,FOOD,NA,visible,Prepared food and beverage,NA,NA,NA,Y,9.00,N,N,5.4,0,NA,NA,N,N
#kansas-city-canning-co-sriracha-pickled-green-beans-regular,UJC3KXLHQVKAE5RQ2XS3AD7I,Kansas City Canning Co. Sriracha Pickled Green Beans,Regular,NA,604348881118,NA,FOOD,NA,hidden,Prepared food and beverage,NA,NA,NA,Y,14.00,N,N,8.4,0,NA,NA,N,N
#kansas-city-canning-co-unfiltered-hoppy-pickles-regular,RRDTNRAKTPF4I2F625GTD2AT,Kansas City Canning Co. Unfiltered Hoppy Pickles,Regular,NA,604348881132,NA,FOOD,NA,visible,Prepared food and beverage,NA,NA,NA,Y,12.00,N,N,7.2,-1,Y,6,N,N
#kansas-city-everything-chili-crunch-regular,DPE3MT2D3HYF6DUZ4XYHAVL3,Kansas City Everything Chili Crunch,Regular,NA,604348881934,NA,FOOD,NA,visible,Prepared food and beverage,NA,NA,NA,NA,12.00,N,NA,7.2,4,NA,NA,N,N
#kansas-city-giardiniera-regular,XGW62NNA3C6564E2SYAILTHB,Kansas City Giardiniera,Regular,NA,604348881484,NA,FOOD,NA,visible,Prepared food and beverage,NA,NA,NA,NA,14.00,N,NA,8.4,7,NA,NA,N,N
#keep-it-crunchy-regular,TU4XGBCJVOCZE5HIDCM7OFUX,Keep it Crunchy,Regular,NA,NA,NA,Beer,649440004201,hidden,Prepared food and beverage,NA,NA,N,Y,17.00,N,NA,11.4,0,N,0,N,N
#kievelstadt-kc-labs-zinfandel--regular,FGQ5IZLLTC2BOB7FQWRFLO3U,Kievelstadt - KC Labs (Zinfandel),Regular,NA,NA,Bin 31,Wine,850330008135,visible,Prepared food and beverage,N,N,N,Y,24.00,N,N,16.66,49,Y,24,N,N
#kikusui-junmai-ginjo-regular,5STHERIVTVASHDCQ5LMXE73D,Kikusui Junmai Ginjo,Regular,NA,072546011413,NA,Wine,072546011673,NA,Prepared food and beverage,N,N,N,N,38.00,N,N,30.6,0,NA,NA,N,N
#kinderhook-mini-pure-sheep-milk-cheese-regular,EE23NV5MIHQ4RVXOFY5QS324,Kinderhook Mini Pure Sheep Milk Cheese,Regular,NA,639511100055,NA,FOOD,NA,visible,Prepared food and beverage,NA,NA,N,Y,7.00,N,N,5.25,0,NA,NA,N,N
#kitchen-garden-organic-giardiniera-regular,COZBR7CCL2T4FZ5VFOT3EYHT,Kitchen Garden Organic Giardiniera,Regular,NA,NA,NA,FOOD,850004955024,visible,Prepared food and beverage,NA,NA,Y,Y,14.00,N,NA,8.4,13,NA,NA,N,N
#kold-kolsch-regular,47AIMCI36MUEMBGDLAPPNRJH,Kold Kolsch,Regular,NA,722208314153,NA,Beer,NA,visible,Prepared food and beverage,NA,NA,NA,NA,15.00,N,NA,10,0,NA,NA,N,N
#kriya-pecorino-regular,CQUGIX6WLWL5BMQQFCRGI5GL,Kriya Pecorino,Regular,NA,NA,NA,Wine,716146141100,NA,Physical good,NA,NA,NA,NA,16.00,N,NA,11,1,NA,NA,N,N
#kumusha-cabernet-sauvignon--regular,T3H23IEN3EW7XKHYEWVCSBGU,Kumusha (Cabernet Sauvignon),Regular,NA,NA,Bin 43,Wine,6009609600745,visible,Prepared food and beverage,N,N,N,Y,16.00,N,N,11,16,Y,24,N,N
#kumusha-chenin-blanc--regular,5CHIAFDPUG3GOW2XSPLGENR5,Kumusha (Chenin Blanc),Regular,NA,9169625,Bin 42,Wine,6009609600752,visible,Prepared food and beverage,N,N,N,Y,16.00,N,N,11,15,Y,24,N,N
#kunik-by-nettle-meadow-9oz-regular,UUZJQJNBNOC5XD65Z5CBICLA,Kunik by Nettle Meadow 9oz,Regular,NA,892838002147,NA,FOOD,892838002147,visible,Prepared food and beverage,NA,NA,NA,NA,24.00,N,NA,16.7,4,NA,NA,N,Y
#l-austral-manta-2021-regular,AOOBG6MNYSNJH7MILPB3ABE3,L'austral Manta 2021,Regular,NA,NA,Bin 182,Wine,NA,visible,Prepared food and beverage,N,N,Y,Y,26.00,N,N,18,17,Y,5,N,N
#la-bobine-regular,BRH6IHXANUGKZJCA62MF53WO,La Bobine,Regular,NA,BOBINE,Bin 183,Wine,NA,visible,Prepared food and beverage,NA,NA,Y,Y,22.00,N,N,15.5,16,Y,5,N,N
#la-chapini-re-sauvignon-regular,WO45MBG6Q3FPC5GFLLHF7MOX,La Chapinière Sauvignon,Regular,NA,3512672150756,BIN 196,Wine,NA,visible,Prepared food and beverage,N,N,Y,Y,16.00,N,N,10.66,8,Y,12,N,N
#la-chouffe-belgium-blonde-regular,WSRHDGBGGUMIXFXCKMAOQQTO,La Chouffe Belgium Blonde,Regular,NA,NA,NA,Beer,5410769133089,visible,Prepared food and beverage,NA,NA,N,Y,13.00,N,NA,9.3,0,N,0,N,N
#la-croix-marguatot-regular,GIIJUJXS6NO45KLAUUHMBAI5,La Croix Marguatot,Regular,NA,NA,NA,Wine,089806014312,visible,Prepared food and beverage,NA,NA,NA,NA,40.00,N,NA,19.98,3,NA,NA,N,N
#la-fonte-crushed-tomatoes-regular,OZOQRTCVZATXZLKJFPGWXBMR,La Fonte Crushed Tomatoes,Regular,NA,850040076035,NA,FOOD,NA,visible,Prepared food and beverage,NA,NA,NA,NA,5.00,N,NA,3.16,13,NA,NA,N,Y
#la-fonte-pomodoro-regular,OFMFQ6IBCWVDBATIKP3DAMXV,La Fonte Pomodoro,Regular,NA,NA,NA,FOOD,NA,visible,Prepared food and beverage,NA,NA,NA,NA,7.00,N,NA,3.66,16,NA,NA,N,N
#la-fonte-tomato-puree-regular,VAT2PMU45BJYUXNIG7BBAHL6,La Fonte Tomato Puree,Regular,NA,NA,NA,FOOD,850040076349,visible,Prepared food and beverage,NA,NA,NA,NA,6.00,N,NA,3.16,8,NA,NA,N,N
#la-fonte-whole-peeled-plum-tomatoes-with-basil-regular,4DM4I6E2XB4UR4E2A3NQGYGS,La Fonte Whole Peeled Plum Tomatoes with Basil,Regular,NA,NA,NA,FOOD,850040076066,NA,Prepared food and beverage,NA,NA,NA,NA,8.00,N,NA,4.16,3,NA,NA,N,N
#la-fonte-whole-peeled-tomatoes-with-basil-regular,N6PTGGYKHSHRPUOPZXV7KOLQ,La Fonte Whole Peeled Tomatoes With Basil,Regular,NA,850040076059,NA,FOOD,NA,NA,Prepared food and beverage,NA,NA,NA,NA,8.00,N,NA,4.16,8,NA,NA,N,N
#la-moussiere-alphonse-mellot-sancerre-regular,QURVRBVCXESL2F3NTGOJ2G6N,La Moussiere Alphonse Mellot Sancerre,Regular,NA,3273390117505,Bin 207,Wine,3273390117505,NA,Prepared food and beverage,N,N,N,N,39.00,N,N,26.67,7,Y,5,N,N
#la-narval-galician-mussels-in-spanish-sauce-regular,PKVDESVVESAJ55M5DFILUWKW,La Narval Galician Mussels In Spanish Sauce,Regular,NA,810032722043,NA,Tinned Fish,NA,visible,Prepared food and beverage,NA,NA,Y,Y,9.00,N,N,4.69,-1,NA,NA,N,N
#la-narval-light-tuna-belly-ventresca-fillets-in-olive-oil-110g-3-88oz--regular,HNNM7DIX77CGEACECFX4SWQE,La Narval. Light Tuna Belly Ventresca Fillets in Olive Oil. 110g (3.88oz),Regular,NA,810032722104,NA,FOOD,810032722104,NA,Physical good,NA,NA,NA,NA,17.00,N,NA,8.39,10,NA,NA,N,N
#la-quercia-sliced-prosciutto-americano-regular,EJI4RDISLH3R2BGFIAYN5NY5,"La Quercia, Sliced Prosciutto Americano",Regular,NA,NA,NA,FOOD,824843119084,unavailable,Prepared food and beverage,N,N,N,N,11.00,N,N,7.75,1,NA,NA,N,N
#la-rose-sardinhas-em-azeite-com-aroma-de-fumo-regular,WYGJUAQO5JUDJSZ3QJHOUTQV,La Rose Sardinhas Em Azeite Com Aroma De Fumo,Regular,NA,5601010611917,NA,Tinned Fish,NA,unavailable,Physical good,N,N,N,N,11.00,N,N,5.53,6,Y,5,N,N
#la-rose-sardinhas-em-azeite-com-pickles-regular,SYLQMXU7OJ6ORCT3JBL2TBHQ,La Rose Sardinhas Em Azeite Com Pickles,Regular,NA,5601010611931,NA,Tinned Fish,5601010611931,NA,Physical good,N,N,N,N,11.00,N,N,4.8,12,Y,5,N,N
#la-sala-del-torriano-chianti-regular,HUW45WOJTU7HUUMBYSOGDIQJ,La Sala Del Torriano Chianti,Regular,NA,5654605,Bin 64,Wine,716146251007,hidden,Prepared food and beverage,N,N,N,Y,25.00,N,N,15.67,0,Y,24,N,N
#la-spinetta-il-rose-casanova-sangiovese-prugnolo--regular,UAEAYNKYPYYV75624HG3P3XU,La Spinetta Il Rose Casanova (Sangiovese/Prugnolo),Regular,NA,373842W,Bin 50,Wine,8022252411719,visible,Prepared food and beverage,N,N,N,Y,20.00,N,N,12.67,8,Y,24,N,N
#la-spinetta-langhe-rosso-nebbiolo--regular,BUI4ZUQK2ZNP6WS7ROWAQ2EM,La Spinetta Langhe Rosso (Nebbiolo),Regular,NA,810816M,Bin 48,Wine,8022252111510,visible,Prepared food and beverage,Y,NA,N,Y,32.00,N,N,23,5,Y,5,N,N
#la-spinetta-toscana-vermentino--regular,VMMPACEW7JBJ2XVXHPJ3VLJK,La Spinetta Toscana (Vermentino),Regular,NA,376936K,Bin 49,Wine,8022252311767,visible,Prepared food and beverage,N,N,N,Y,20.00,N,N,13.34,2,Y,24,N,N
#la-stoppa-trebbiolo-rossa-barbera-bonarda--regular,ICLYKSB4RTY4I5DNXGRYKPGB,La Stoppa Trebbiolo Rossa (Barbera/Bonarda),Regular,NA,trebillo La Stoppa,Bin 26,Wine,NA,visible,Prepared food and beverage,NA,NA,Y,Y,25.00,N,N,15,6,Y,5,N,N
#la-val-albari-o-dsc-regular,EMWSI3U5N3OBZZA7QMY3DYYQ,La Val (Albariño) DSC,Regular,NA,NA,"La Val Albariño is a captivating white wine that hails from the prestigious Rías Baixas region of Spain. Known for its vibrant character and aromatic charm, La Val Albariño is a true expression of the region's maritime influence and the indigenous Albariño grape variety.
In the glass, La Val Albariño shines with a pale straw color, hinting at its youthful and fresh nature. As you bring the glass to your nose, the wine releases an enchanting bouquet of citrus fruits, particularly ripe lemons and juicy grapefruits. Delicate floral notes of white blossoms and a subtle hint of tropical fruits, such as pineapple and peach, add a delightful complexity to the aromatic profile.
Upon the first sip, La Val Albariño reveals its vibrant personality. The wine dances on the palate with lively acidity, refreshing the senses with its zesty citrus flavors. The prominent notes of lemon and grapefruit are accompanied by a touch of green apple, providing a crisp and invigorating sensation. There is a distinct mineral qu",Wine,685443210553,visible,Prepared food and beverage,N,N,Y,Y,19.00,N,N,11.33,1,Y,5,N,N
#landhaus-mayer-gruner-veltliner--regular,Z3JAJAIPNNU4PP25LO7HSELE,Landhaus Mayer (Gruner Veltliner),Regular,NA,9003979001482,Bin 35,Wine,9009809001400,visible,Prepared food and beverage,N,N,N,Y,18.00,N,N,9.67,19,Y,24,N,N
#landhaus-mayer-riesling-regular,4D4MNR4VOA3KIVQQBJSOVVRL,Landhaus Mayer Riesling,Regular,NA,9003979001475,Bin 202,Wine,9003979001475,visible,Prepared food and beverage,N,N,Y,Y,15.00,N,N,10.34,9,Y,12,N,N
#landhaus-mayer-ros--regular,MF3FNBQZKS7GI6QG7MIWK2ML,Landhaus Mayer Rosé,Regular,NA,W216617,Bin 201,Wine,9009809001592,visible,Prepared food and beverage,N,N,N,Y,16.00,N,N,10.67,0,Y,24,N,N
#lapa-nero-d-avola-regular,ASNRJY4K7CVENY5LCTIYOGN4,Lapa Nero d' Avola,Regular,NA,NA,Bin 260,Wine,8059388830039,unavailable,Prepared food and beverage,N,N,N,N,16.00,N,N,10.33,6,Y,24,N,N
#large-bowl-regular,QATCDW5F6PWLFVXWWVJXOY7Q,Large Bowl,Regular,NA,K065549,NA,Pottery,NA,visible,Prepared food and beverage,N,N,N,Y,65.00,N,N,32.5,1,NA,NA,N,Y
#large-cutting-board-regular,XAZNFKPQHDIQYIQPQEQQLVFK,Large Cutting Board,Regular,NA,LCB,NA,Cutting Boards - Made by Nate,NA,hidden,Prepared food and beverage,NA,NA,NA,Y,65.00,N,NA,NA,0,NA,NA,N,Y
#large-doll-regular,Q4NJWU2JIM2D7OAWGRQLZH4N,Large Doll,Regular,NA,FLD,NA,Art,NA,visible,Physical good,NA,NA,NA,NA,35.00,N,NA,28,2,NA,NA,N,Y
#large-gray-plate-regular,XNZPVWPALRLJX2C73DCAC2XQ,Large Gray Plate,Regular,NA,LGP,NA,Pottery,NA,unavailable,Physical good,N,N,N,N,75.00,N,N,37.5,0,NA,NA,N,Y
#large-harbison-jasper-hill-regular,JUFJSCJUXSGVW6PXN6LMV444,Large Harbison Jasper Hill,Regular,NA,814836020015,NA,FOOD,NA,visible,Prepared food and beverage,N,N,N,Y,24.00,N,N,11.99,5,NA,NA,N,N
#large-jars-regular,QVH6Q7EDGJ7FNR5AMI6AT4VE,Large Jars,Regular,NA,C996957,NA,Pottery,NA,visible,Prepared food and beverage,NA,NA,NA,Y,65.00,N,NA,NA,2,NA,NA,N,Y
#large-platter-regular,BRYSI4PJVI6RHFCRP45C7C5B,Large Platter,Regular,NA,V202608,NA,Pottery,NA,visible,Prepared food and beverage,NA,NA,NA,Y,150.00,N,NA,NA,4,NA,NA,N,Y
#large-ramen-bowl-regular,Q7B2OJGT2VTKRLZ2FKRPZTPE,Large Ramen Bowl,Regular,NA,3450428,NA,Pottery,NA,hidden,Prepared food and beverage,NA,NA,NA,Y,35.00,N,NA,NA,-1,NA,NA,N,Y
#large-vase-regular,JU44IT2B3CSFKEJGJOZJVESA,Large Vase,Regular,NA,VASELG,NA,Pottery,NA,unavailable,Physical good,N,N,N,N,350.00,N,N,175,1,NA,NA,N,Y
#lasorda-cabernet-sauvignon-regular,7PHJRZJQGSRN5OKAMRJT43IS,Lasorda Cabernet Sauvignon,Regular,NA,NA,Bin 236,Wine,868594000314,unavailable,Prepared food and beverage,N,N,N,N,26.00,N,N,16.67,20,NA,NA,N,N
#laura-lardy-la-gourde-a-gamay--regular,L7WVDQEPU4HPFZKL6XI6F5YD,Laura Lardy La Gourde A (Gamay),Regular,NA,6898245,"Bin 115
Organic beaujolais. Light-bodied, fruity (cranberry notes), easy to drink.",Wine,727760519145,hidden,Prepared food and beverage,N,N,N,Y,22.00,N,N,12,0,Y,12,N,N
#le-chai-duchet-macon-villages-regular,K7NCV4UAPS4E5QBQE6LFIMJI,Le Chai Duchet Macon-Villages,Regular,NA,LCDMV,Bin 52,Wine,NA,unavailable,Physical good,N,N,N,N,28.00,N,N,14,16,NA,NA,N,N
#les-athletes-du-vin-chenin-blanc-dsc-regular,ETV4HBB4WCUPASWRAZ6G7DVX,Les Athletes Du Vin (Chenin Blanc) DSC,Regular,NA,888436A,"Bin 68
Ah, Les Athletes du Vin Chenin Blanc! A wine so smooth and crisp, it could give Olympic gymnasts a run for their money. With a balance as perfect as a medal-winning figure skater, this Chenin Blanc will leave you feeling like a champion.
The aroma of Les Athletes du Vin Chenin Blanc is like a sprinter exploding off the starting block, with notes of fresh citrus and green apple rushing to your nose. On the palate, flavors of juicy peach and pear glide across your taste buds like a synchronized swimming routine at Margaret Lindley Park.
This wine is so refreshing, it's like taking a dip in a pool after running up Mt. Greylock. And just like a marathon runner, it has great endurance – its delicious taste lasts from the first sip all the way through the finish line. So pour yourself a glass of Les Athletes du Vin Chenin Blanc, and let this wine be your coach to victory!",Wine,3760087931822,hidden,Prepared food and beverage,N,N,N,Y,19.00,N,N,11.33,0,Y,24,N,N
#les-athletes-du-vin-chinon-cabernet-franc--regular,YNGIIXORK4GDVQLKAH7IPNMR,Les Athletes Du Vin Chinon (Cabernet Franc),Regular,NA,F420593,"Bin 69
Les Athletes du Vin Chinon Cabernet Franc! This wine is so smooth and bold, it's like a rugby player in a tutu - unexpected, but oh so delightful.
With a kick like a soccer star and the finesse of a ballerina, this Cabernet Franc is sure to impress even the toughest critics. The aroma is like a javelin thrower, with hints of dark berries and a touch of earthiness.
On the palate, flavors of black currant and a subtle hint of pepper burst forth like a shot put flying through the air. It's like watching a high jump, as the wine jumps up to new heights of deliciousness with each sip.
Les Athletes du Vin Chinon Cabernet Franc is so rich and velvety, it's like sinking into a plush leather couch after a long day of training. And just like a wrestler, it has the strength to hold its own against any meal or occasion.
So whether you're celebrating a victory or just enjoying a night in, let Les Athletes du Vin Chinon Cabernet Franc be your teammate. Cheers to a winning combination!",Wine,3760087930993,visible,Prepared food and beverage,N,N,N,Y,18.00,N,N,12.5,2,Y,24,N,N
#les-collines-meyer-lemon-rosemary-preserves-regular,WFTQRYXYH75H7CNIOMNVKZCI,Les Collines Meyer Lemon Rosemary Preserves,Regular,NA,meyerlemon,NA,FOOD,NA,visible,Prepared food and beverage,NA,NA,NA,NA,20.00,N,NA,10.9,4,NA,NA,N,N
#les-collines-strawberry-lapsang-souchong-preserves-regular,ZY3Y6GTPZOMNNCR2IIWXFAFC,Les Collines Strawberry Lapsang Souchong Preserves,Regular,NA,strawberrysouchong,NA,FOOD,NA,visible,Prepared food and beverage,NA,NA,NA,NA,20.00,N,NA,10.9,2,NA,NA,N,N
